https://www.udemy.com/course/data-science-machine-learning-mastery/,"Have an in-depth understanding of the concepts of Machine Learning Be able to grasp, understand, and write machine learning code from scratch Use Builtin Libraries available to build machine learning models Be able to analyze, build, and assess models on any dataset Be able to interpret and understand the black box behind model Understand the applications of data science by exhibiting the ability to work on different datasets and interpreting them. ",Machine Learning Mastery (Integrated Theory+Practical HW),4.8
https://www.udemy.com/course/tensorflow-bootcamp-for-data-science-in-python/,Harness The Power Of Anaconda/iPython For Practical Data Science Learn How To Install & Use Tensorflow Within Anaconda Implement Statistical & Machine Learning With Tensorflow Implement Neural Network Modelling With Tensorflow Implement Deep Learning Based Unsupervised Learning With Tensorflow Implement Deep Learning Based Supervised Learning With Tensorflow,Tensorflow Deep Learning - Data Science in Python,4.2
https://www.udemy.com/course/introduction-to-data-science/,"Start and execute the steps of a data science project, from project definition to model evaluation. Use machine learning techniques to build effective predictive models. Learn how to find and correct common problems found in real world data. ",Introduction To Data Science,4.3
https://www.udemy.com/course/data-science-4-newbs/,"Get basic skills in Unix, SQL, Tableau, and statistics applied to basic experiment analysis Be prepared for the advanced course by the instructor, ""Advanced Data Science: Master Deep Web Experiment Analysis"" ",Data Science 4 Newbs! Skills + Basic Web Experiment Analysis,4.3
https://www.udemy.com/course/r-for-data-science-learn-r-programming-in-2-hours/,Master all the basics of R Programming Learn basic concepts of Data Science Learn how to learn programming by yourself. Develop problem solving ability Pass their exams related to R,R for Data Science: Learn R Programming in 2 Hours,4.3
https://www.udemy.com/course/business-statistics-masterclass-hypothesis-testing/,You will learn how to apply basic principles of Statistical Inference i.e. the T - test and F - test to Decision Making.,AB Testing / Hypothesis Testing,4.6
https://www.udemy.com/course/qlik-sense-advanced/,Recap on basic Qlik Sense topics Connecting and associating data Qlik Sense Scripting using the script editor Geo-analysis Determine correlation between variables Different methods of loading data via scripting Manipulating fields through scripting Using variables in scripting Different concatenation methods through scripting Dealing with synthetic keys Script debugging Mapping tables Working with QVD files Extending Qlik Sense chart capability through Extensions Advanced Set Analysis,Qlik Sense Masterclass for Data Science and BI,5
https://www.udemy.com/course/data-science-for-marketing-analytics/,"Analyze and visualize data in Python using pandas and Matplotlib Study clustering techniques, such as hierarchical and k-means clustering Create customer segments based on manipulated data Predict customer lifetime value using linear regression Use classification algorithms to understand customer choice Optimize classification algorithms to extract maximum information ",Data Science for Marketing Analytics,4.2
https://www.udemy.com/course/linear-algebra-an-introduction/,"Refresh your math knowledge. Gain a firm foundation in Linear Algebra for furthering your career. Learn one of the mathematical subjects crucial for Computer Science. Learn one of the mathematical subjects crucial for engineering, computer science, physics, economics, computer animation, and cryptography among many others. Learn one of the mathematical subjects needed for Data Science. Learn a mathematical subject useful in becoming a Quant on Wall Street. ",Linear Algebra for Beginners: Open Doors to Great Careers,4.3
https://www.udemy.com/course/introduction-to-big-data-data-science/,"Big Data and Data Science in Practice (Healthcare, Logistics & Transportation, Manufacturing, and Real Estate & Property Management industries) Big Data Definition and Data Sources. Why we need to be data and technology savvy. Introduction to Data Science and Skillset required for working with Big Data Technological Breakthroughs which Enable Big Data Solutions (Connectivity, Cloud, Open Source, Hadoop and NoSQL) Big Data Technology Architecture and most popular technology tools used for each Architecture Layer Introduction to Data Analysis, Artificial Intelligence and Machine Learning Overview of Machine Learning Algorithms and Neural Networks ","Intro to Big Data, Data Science and Artificial Intelligence",4.4
https://www.udemy.com/course/deep-learning-calculus-data-science-machine-learning-ai/,"Build Mathematical intuition especially Calculus required for Deep learning, Data Science and Machine Learning The Calculus intuition required to become a Data Scientist / Machine Learning / Deep learning Practitioner How to take their Data Science / Machine Learning / Deep learning career to the next level Hacks, tips & tricks for their Data Science / Machine Learning / Deep learning career Implement Machine Learning / Deep learning Algorithms better Learn core concept to Implement in Machine Learning / Deep learning ",Deep Learning Complete Guide for Calculus - Machine Learning,4.4
https://www.udemy.com/course/ultimate-machine-learning-with-r/,"Master prediction and model assessment Work with R, the language of data science Gain deep insights into the application of machine learning tools in the industry Understand and apply machine learning methods using an extensive set of R packages Implement advanced concepts in machine learning Understand how working with complex data is different to standard numerical work Manipulate data in R efficiently to prepare it for analysis Master the skill of recognizing techniques for effective visualization of data Understand why and how to create test and training data sets for analysis ",Data Science: Machine Learning and Statistical Modeling in R,4.3
https://www.udemy.com/course/data-science-and-machine-learning-in-r-programming/,"Learn Basic principal of programming How to install R and RStudio How to use RStudio How to create variable, looping and decision making in programming Vectors in R Function and packages in R Learn Matrices and Dataframe of R Data visualization using ggplot2 ",Data Science and Analytics in R Programming,4.3
https://www.udemy.com/course/pandas-seaborn-data-science-and-visualization-masterclass/,"Understand the Scientific Python Ecosystem Understand Data Science, Pandas, and Altair Learn basics of NumPy Fundamentals Learn Advanced Data Visualization Learn Data Acquisition Techniques Linear Algebra and Matrices ",Pandas & Seaborn Data Science and Visualization Masterclass,4.2
https://www.udemy.com/course/data-science-for-professionals/,"Students will be able to analyze, manipulate, explore, illustrate, and report data in ways that will set them far apart from those who use spreadsheets and other traditional Office products. ",Data Science for Professionals,4.2
https://www.udemy.com/course/data-science-and-machine-learning-with-python/,"Data Science using Python Python libraries such as NumPy, Pandas, Matplotlib, Pyplot etc Analyzing real word data using Python and other tools Machine Learning ",Data Science and Machine Learning with Python,4.5
https://www.udemy.com/course/pythonnumpy/,Code in the Python 3.5 programming language Create and manipulate dataframes with pandas Create NumPy arrays,Crack Pandas and NumPy: Python Data Science Made Easy,4
https://www.udemy.com/course/bite-sized-data-science-with-python-introduction/,"Manipulate and transform data series and tables in Python Build a multiple regression model in Python Use iPython Notebook for research and analysis in Python Visualize data to glean insights from it, in Python ",Bite-Sized Data Science with Python and Pandas: Introduction,4.2
https://www.udemy.com/course/sql-reporting-and-analysis-for-beginners/,Setup SQL Query Environment Retrieve Data using SELECT Statement Remove Duplicate Records Sort Returned Records Analyse data using subqueries Analyse data using nested subqueries Filter data using WHERE Clause Filter data using various operators Report on aggregated data Analyse data from multiple tables,SQL: Reporting and Analysis for beginners,4.2
https://www.udemy.com/course/deep-learning-neural-networks-python-keras-for-dummies/,Deep Learning and Convolutional Neural Networks using Python for Beginners,Deep Learning & Neural Networks Python - Keras : For Dummies,4.2
https://www.udemy.com/course/what-to-be-a-big-data-scientist/,Understanding of Data Science concepts and Process Knowledge or roles and suitability for them Challenges in Data Science Building a transition Plan,Want to be a Big Data Scientist?,4.2
https://www.udemy.com/course/complete-python-beginners-course-python-deluxe-edition/,"Students will learn what are values and variables in Python. They will learn about the algorithms of Python. They will be able to identify the errors in Python. Students will learn what is Iteration in Python. Students will be able to use functions related to Python. How students can make a calculator, a rolling die, tree drawing function as well as prime number generator. Students will be able to learn different objects of Python ",Complete Python Beginners Course: Python Deluxe Edition™,4.2
https://www.udemy.com/course/learning-sparklyr-basics/,Learn to perform exploratory data analysis in Spark using sparklyr Understand the differences between working with data frames in R and Spark Learn how to connect to Spark locally or to a remote Spark cluster Learn how to build data products in R that don't rely on storing big data locally Learn how to interact with data in Apache Spark through sparklyr and Spark SQL,Data Science: Sparklyr Basics for Beginners,4.2
https://www.udemy.com/course/data-science-with-r-beginners/,"Learn R programming, Reproducible Analysis and Data Manipulation Master data visualization, Learn working with Large Datasets, Supervised Learning and Unsupervised Learning Learn Object oriented Programming, start building an R package. Know more on Testing and Package and checking Version Control and Profiling and Optimizing ",Data Science with R - Beginners,4
https://www.udemy.com/course/cybersecurity-data-science/,Use machine learning to classify malware. Malware analysis 101. Set up a cybersecurity lab environment. Learn how to tackle data class imbalance. Unsupervised anomaly detection. End-to-end deep neural networks for malware classification. Create a machine learning Intrusion Detection System (IDS). Employ machine learning for offensive security. Learn how to address False Positive constraints. Break a CAPTCHA system using machine learning.,Cybersecurity Data Science,4.2
https://www.udemy.com/course/machine-learning-with-python-for-dummies-the-complete-guide/,Machine Learning and Data Science using Python for Beginners,Complete Python Machine Learning & Data Science for Dummies,4.2
https://www.udemy.com/course/sas-programming/,"You will learn the SAS language from scratch and we will get you to an expert level! You will learn from the basics: Importing Data, SAS Variables, SAS Dates, Formats, Procedures and much more! We will teach how to use the Data Step to do all types of data manipulations, filtering, transforming variables, do complex calculations. Learn how to combine data, transpose , use do loops, arrays, summarize data with pivot tables, creating professional reports. Learn how to use SAS Functions to manipulate Character, Numeric, Date Variables. ",Complete SAS Programming Bootcamp 2019: Go from zero to hero,3.8
https://www.udemy.com/course/pro-data-science-in-python/,"Use complex scikit-learn tools for machine learning Do statistical analysis using Statsmodels Read, transform and manipulate data using Pandas Use Keras for neural networks Solve both supervised and unsupervised machine learning problems Do time series analysis and forecasting using Statsmodels Classify images using Deep Convolutional Networks ",Pro data science in Python,4.2
https://www.udemy.com/course/big-data-cloud-data-science-iot-ml-executive-summary/,"Understand the breath and depth of various technologies in iSMAC world Various technologies in Cloud, Bigdata, Machine Learning, DevOps, IoT, etc., Understand how Raspberry Pi, Arduino interact with Bigdata and Cloud Technologies Understand various technologies like Rapid application development and continuous delivery ","Big data, Cloud, Data Science, IoT, ML - iSMAC - All in One",4.2
https://www.udemy.com/course/pythonmatplotlib/,"Code in the Python 3.5 programming language. Make games with Python. Create basic line and scatter plots with Matplotlib 1.5. Read finance data directly from Yahoo. Customise our graphs with visuals, a title, labels, text and a legend. Recognize types of visualization: histograms, pie charts, and box and whisker plots. Make candlestick plots. Understand figures and subplots. Perform in-depth customization of plot structure Understand basic 3D plotting. ",Make 2D & 3D Graphs in Python with Matplotlib for Beginners!,4.2
https://www.udemy.com/course/data-science-and-machine-learning-in-python/,"Machine Learning in Python Complete SQL BootCamp Using PostgreSQL TABLEAU - The Best Visualization Software Data Science concepts Data Wrangling, Cleaning and Data Preparation for Machine Learning Supervised and Unsupervised machine learning Python Model Selection Feature Engineering Dimensionality Reduction Regression Classification ",Data Science and Machine Learning in Python,4.3
https://www.udemy.com/course/python-programming-for-creatives/,Introduction to Python and the Interpreter Obtaining user input and correcting Errors Performing Operations Making Statements Defining Functions Importing Modules Managing Strings Calculations and Variables Store Data Use functions to simplify programs,Python for Data Science,4.2
https://www.udemy.com/course/sprint-the-data-science-interview/,Most frequently asked questions in data science interviews Quickly learn the basics required to understand and work on data science projects Bottom up approach to start data science learning Cracking the data science interview Cracking the Machine Learning Interview Machine Learning Pipelines,Sprint the Data Science Interview,4.2
https://www.udemy.com/course/practical-guide-to-alteryx-for-data-science/,"Learn the 3 Step Process to Data Science: Data Management, Data Wrangling, and Data Analytics Master the Fundamentals of ETL and Alteryx Designer Platform Create Fully Automated Reports with Custom Visualizations and Insights Leverage Alteryx to Improve Business Process Automation for Business Intelligence and Business Analytics Learn about Data Preparation, Data Cleansing / Cleaning, Data Joinery, Data Transformation, and Data Integration Create unique Data Analysis with Custom Formulas and Calculations Learn about Spatial Analysis / Geo Analytics in Alteryx Integrate Basic R Script & Python codes into your workflow ",A Practical Guide to Alteryx for Data Science & Analytics,4.1
https://www.udemy.com/course/statistical-modeling-for-data-science/,Understand what a Normal Distribution is difference between continuous and discrete variables Apply Hypothesis Testing for Means Use the Z-Score and Z-Tables Understand standard deviations what a sampling distribution is Apply the Central Limit Theorem,Statistical Modeling for Data science,4.4
https://www.udemy.com/course/sas-programming-for-beginnersprofessionals/,"After taking this course students will be able to write programs using SAS as a tool, this course will be a guide for them to take them to the next level of expertise pertaining SAS. This is going to give a great Curve to beginners/professionals to use SAS as a tool for their data work. ",SAS for Data Science,4.1
https://www.udemy.com/course/practical-data-science-reducing-high-dimensional-data-in-r/,"Understand various ways of reducing wide data sets Understand Principal Component Analysis (PCA) Control, tune and measure the effects of PCA Use GBM modeling to measure the effectiveness of PCA Reducing dimensionality with classic GBM & GLMNET Variable Selection Use ensembling techniques to find the most stable variables ",Practical Data Science: Reducing High Dimensional Data in R,4.1
https://www.udemy.com/course/probability-and-statistics-for-machine-learning-1/,Basic Definitions related to Probability Theory Mathematical Definition of Probability Important Symbols and Results related to Probability Theory Conditional Probability Theorem of Total Probability Baye's Theorem Bernoulli's Trials Probability of Uncountable Uniform Spaces,Introduction To Applied Probability,4.1
https://www.udemy.com/course/advanced-r/,Build R packages Write C++ code in R via Rcpp Do complex date parsing Profile and benchmark their programs Build parallel code Parse complex text via Regex And much more!,Advanced R,4.1
https://www.udemy.com/course/microsoft-azure-machine-learning-fundamentals/,Build basic data science experiments using Microsoft Azure Machine Learning Understand and apply Microsoft Azure Machine learning concepts to real world problems Learn Azure ML Studio Become proficient at Machine Learning workings including predictive analysis,Microsoft Azure Machine Learning (ML) Fundamentals,4.1
https://www.udemy.com/course/python-for-data-analysis-beginner-to-advanced/,"Be equipped with the powerful Python language to start an amazing data analysis career Be ready to work in Finance and Pharmaceutical industries that requires Python programming skills Master how to import and merge data, clean your data, and use conditional logic Be able to create charts and plots for data (visualization) Learn how to generate statistics such as mean value, median value, and standard deviation ",Learn Python - Data Analysis From Beginner To Advanced,4.1
https://www.udemy.com/course/advanced-statistics-and-data-mining-for-data-science/,Get familiar with advanced statistics and data mining techniques Differentiate between the various types of predictive models Master linear regression Explore the results of a decision tree Work with neural networks Understand when to perform cluster analysis and when to use association modeling,Advanced Statistics and Data Mining for Data Science,4.1
https://www.udemy.com/course/r-language-with-hands-on-experience/,TO go through deep understanding of R language basics and packages and many hand on examples,R Programming:For Data Science With Real Exercises,4
https://www.udemy.com/course/practical-data-analysis-and-visualization-with-python/,"Understand the logic behind machine learning models without strain Build forecasting models with machine learning Analyze customer satisfaction Analyze bank statements Classify images Learn how to preprocess data Develop classification models Build Fraud Detection models Logistic Regression models k-nearest neighbor models Random Forest Models Support Vector Machines Learn NumPy package Learn Pandas package Learn Scikit-learn Filter and Slice datasets Visualize data with Matplotlib Visualize data with Seaborn Get comfortable creating Pie charts, Donut charts, Bar charts, Line charts, Scatter plots and more Read data from Google Sheets Splitting data into training and test sets Classify objects with Naive Bayes Develop supervised learning models Linear Regression models ",Practical Data Analysis and Visualization with Python,4.1
https://www.udemy.com/course/beginner-to-advanced-how-to-become-a-data-scientist/,You can apply important data science methods on any dataset you want You have acquired a deep understanding in data exploration and preparation techniques You understand numpy and it‘s importance for data science You can apply advanced visualization techniques to present your findings you are prepared to dive deeper into machine learning and neural networks You might open up new career opportunities for you which are not only highly rewarding but also offer more job satisfaction,beginner to advanced - how to become a data scientist,4.1
https://www.udemy.com/course/swiftbirads/,Anaconda Jupyter iPython scikit-learn Accelerate Framework Basic Neural Network Subroutines (BNNS) Build Cancer Predicting Neural Network Build Swift BIRADS App!,Hybrid Python3|Swift4 Applications,4.1
https://www.udemy.com/course/jumpstart-to-data-science-machine-learning-using-python/,"You will be able to apply data science algorithms for solving industry problems You will have a clear understanding of industry standards and best practices for predictive model building You will be able to derive key insights from data using exploratory data analysis techniques You will be able to efficiently handle data in a structured way using Pandas You will have a strong foundation of linear regression, multiple regression and logistic regression You will be able to use python scikit-learn for building different types of regression models You will be able to use cross validation techniques for comparing models, select parameters You will know about common pitfalls in modeling like over-fitting, bias-variance trade off etc.. You will be able to regularize models for reliable predictions ",Beginning with Machine Learning & Data Science in Python,4
https://www.udemy.com/course/agile-experiment-analytics/,Understand the key underlying concepts for advanced experiment analytics Build the back end and front end for a deep and agile experiment analytics dashboard Understand the general strategy for how to explore experimental metrics.,Advanced Data Science: Master Deep Web Experiment Analysis!,4.2
https://www.udemy.com/course/text-analyticstext-mining-using-r/,"Perform text mining applications using structured & unstructured data; Understand about document term matrix, term frequency, term frequency inverse document, term frequency for normalizing Differentiate between size of word which indicates the frequency of the said word in a word cloud, clustering based on related use for better insights and how to read the results in context to make sense of the word Understand from a practical case study the various steps of text mining in R and the use of Positive and negative word banks Learn Web and Social media extraction using R, Risk sensing - sentiment analysis, Twitter application management for extracting tweets Understand the clustering concept, that is an integral part of text mining ",Text Mining and NLP using R and Python,4
https://www.udemy.com/course/data-science-interview/,Create a great data science resume! Understand various positions and titles available in the data science ecosystem Build an understanding of good experiment design Get practice with probability and statistics interview question,Data Science Interview Preparation - Career Guide,3.6
https://www.udemy.com/course/forecasting-time-series-using-xlminer-r-and-tableau/,"Learn about different types of approaches using XLminer, R and Tableau Learn about the Forecasting Importance ,Forecasting Strategy which includes Defining goal, Data Collection, Exploratory Data Analysis, Partition Series, Pre-process Data, Forecast Methods, using various Plots. Learn about scatter diagram, correlation coefficient, confidence interval, which are all required for implementing forecasting techniques Learn about the various error measures such as ME, MAD, MSE, RMSE, MPE, MAPE, MASE Learn about Model based Forecasting Techniques such as Linear, Exponential, Quadratic, Additive Seasonality, Multiplicative Seasonality, etc. Learn about Auto Regressive Models for using errors to further strengthen the forecasting model used & also learn about Random walk & how to identify the same Learn about Data Driven approaches such as Moving Average, Simple Exponential Smoothing, Double Exponential Smoothing / Holts, Winters / HoltWinters ","Data Science-Forecasting/Time series Using XLMiner,R&Tableau",4
https://www.udemy.com/course/data-science-beginners-guide-to-the-command-line/,"Data Science From the Command Line Introduction to the Unix Operating System Quick Guide to Shortcut Commands for the macOS Graphical User Interface Basic & Advanced Bash Shell Commands Introduction to the macOS Terminal (Bash Shell) Create, Open, Run, & Save IPython Scripts from the Command Line ",Data Science: Beginners Guide to the Command Line,4
https://www.udemy.com/course/complete-machine-learning-data-science-with-r-programming/,"Fundamentals of Machine learning Data science R programming Data visualization with base R & libraries like ggplot2, lattice, scatter3d plot & more Applied statistics for machine learning covering important topics like standard error, variance, p value, t-test etc. Machine learning models like Neural network, linear regression, logistic regression & more. Handle advance concepts like dimension reduction & data reduction techniques with PCA & K-Means Classification & Regression Tree with Random Forest machine learning model Real life projects to help you understand industry application Tips & Tools to create your online portfolio to promote your skills Tutorial on job searching strategy to find appropriate jobs in machine learning, data science or any other industry. ",Complete Machine Learning & Data Science with R-2019,4
