https://www.udemy.com/course/learn-data-science-with-python/,Will get complete knowledge of Data Science learn essential tool for various types of analysis to get key insights from data and to make key decisions learn to play with data and to extract key information using various Python functions and constructs.,Learn Data Science with Python,3.5
https://www.udemy.com/course/python-for-data-analysis-and-visualization/,"Become an expert on using Python to perform data analysis and visualization Learn the basics as well as popular packages like - Pandas, NumPy and Matplotlib Data mining using Regular Expression to derive meaningful information from the data Learn to use Pandas for Data Analysis Learn to use Matplotlib for Python Plotting Learn to use NumPy for Numerical Data ",Python for Data Science and Visualization -Beginners to Pro,3.6
https://www.udemy.com/course/data-science-with-excel-and-r-the-silicon-valley-way/,"Learn the interdisciplinary concepts of data science with help of success stories and master the typical stages of Solution Implementation with data exploration, preparation, partitioning, model building, model iterations and validation. Learn Inferential statistics and summarize a set of observations using Summary Statistics to identify a single number that describes the entire dataset by using the types of Measures of Central Tendency and differentiate the extend a distribution of data is stretched or squeezed by using Measures of Dispersion. Know how to perform: Binomial, Poisson, Hyper Geometric, Negative Binomial, Geometric discrete probability distributions also learn and implement Normal distribution and T-distribution of continuous probability distribution. Perform hypothesis testing with Normal Distribution and T-distribution using One-Tail and Two-Tail Directional hypothesis even if the sample size is low or the standard deviation is not available or again if the population distribution is not Normal Distribution. Learn how to perform One-Way and Two Way anova for multiple levels or factors influencing the outcome with and without replication and for count and categorical data using Chi-square Test-Of-Association & Goodness-Of-Fit Chi-square Test-Of-Association, Goodness-Of-Fit and more. Follow the program syllabus in our course curriculum to know more in detail. ",Data Scientist Job Ready Data Science Course:,3.7
https://www.udemy.com/course/learning-path-python-machine-and-deep-learning-with-python/,Learn the fundamentals to advanced techniques of Python Explore and use Python's impressive machine learning ecosystem Understand which machine learning algorithms to use in a given context Learn how to evaluate a problem and apply optimal data models to solve it Deploy machine learning models using third-party APIs Get to grips with each and every aspect of deep learning,Learning Path: Python: Machine and Deep Learning with Python,3.5
https://www.udemy.com/course/learn-r-programming-and-data-science-through-exercises/,Solve data problems programmatically with R Programming Get a head start in the complex data science technologies of modern day programming in R Obtain the opportunity to learn more complex things like Machine Learning in R at the end of the course,Learn R Programming and Data Fundamentals Through Exercises,3.5
https://www.udemy.com/course/practical-data-science-analyzing-stock-market-data-with-r/,"Use R on stock market data for insight and ideas Download free, daily stock market data from Yahoo Plot great looking financial charts Apply basic technical analysis on stock market data Explore trading ideas and display entries and exits Gain additional insights by comparing similar stocks ",Practical Data Science: Analyzing Stock Market Data with R,3.4
https://www.udemy.com/course/data-visualization-with-python-the-complete-guide/,Learn to create graphical visualization for your data Learn about data analysis and data clustering Master the mathematical foundation of Data science Learn advance concepts such as Gradient descent and Data munging,Data Visualization with Python: The Complete Guide,3.7
https://www.udemy.com/course/data-science-project-management/,"Plan end to end data science projects including activities involved, dependencies, external/internal resource needs and skills requirements Manage stakeholder expectations on the delivery of data science projects Manage data science team and ensure alignment to larger project/program objectives Plan communications on status reporting of data science projects with details of all activities ",The Complete Data Science Project Management Course,3.4
https://www.udemy.com/course/hands-on-statistical-predictive-modeling/,Differentiate between various types of predictive models Master linear regression Explore the results of logistic regression Understand when to use discriminant analysis Understand the inner workings of your models Maximize your productivity by analyzing your models and interpreting their accuracy in a well-organized manner,Hands-On Statistical Predictive Modeling,3.9
https://www.udemy.com/course/data-manipulation-in-r-with-dplyr/,"Learn how to manipulate data efficiently with dplyr package in R Learn how to use select , filter , arrange , group by and summarise command ",Core skill for data science: learn dplyr package in R,3.3
https://www.udemy.com/course/julia-for-data-science/,"Get to grips with the basic data structures in Julia and learn about different development environments Organize your code by writing Lisp-style macros and using modules Manage, analyze, and work in depth with statistical data sets using the powerful DataFrames package Perform statistical computations on data from different sources and visualize those using plotting packages Apply different algorithms from decision trees and other packages to extract meaningful information from the iris dataset Gain some valuable insights into interfacing Julia with an R application ",Julia for Data Science,3.2
https://www.udemy.com/course/learning-path-julia-explore-data-science-with-julia/,"Get to grips with the basic data structures in Julia and learn about different development environments Organize your code by writing Lisp-style macros and using modules Manage, analyze, and work in depth with statistical datasets using the powerful DataFrames package Perform statistical computations on data from different sources and visualize those using plotting packages Apply different algorithms from decision trees and other packages to extract meaningful information from the Iris dataset Gain some valuable insights into interfacing Julia with an R application Uncover the concepts of metaprogramming in Julia Conduct statistical analysis with StatsBase.jl and Distributions.jl ",Learning Path: Julia: Explore Data Science with Julia,3.3
https://www.udemy.com/course/getting-started-with-data-sciences/,Introduction to Data Sciences Trends in Data Sciences Examples of applications of Data Sciences Introduction to Machine Learning Introduction to Predictive Analytics,Getting Started with Data Sciences,3.4
https://www.udemy.com/course/hands-on-data-science-with-anaconda/,"Perform cleaning, sorting, classification, clustering, regression, and dataset modeling using Anaconda Use the Conda package manager and discover, install, and use functionally efficient and scalable packages Get comfortable with heterogeneous data exploration using multiple languages within a project Perform distributed computing and use Anaconda Accelerate to optimize computational power Discover and share packages, notebooks, and environments, and use shared project drives on Anaconda Cloud Tackle advanced data prediction problems ",Hands-On Data Science with Anaconda,3.2
https://www.udemy.com/course/machine-learning-3/,"Basic idea bout Machine learning technology Different ML algorithm like Regression, Classification & Clustering KNN and Logistic Regression algorithm Linear and Multiple Regression K means Clustering algorithm Overview about Deep Learning, Computer Vision Field ",Data Science & Machine Learning For Non Technical Executives,3.5
https://www.udemy.com/course/r-for-data-science-solutions/,"Get to know the functional characteristics of R language Extract, transform, and load data from heterogeneous sources- Understand how easily R can confront probability and statistics problems Get simple R instructions to quickly organize and manipulate large datasets Create professional data visualizations and interactive reports Predict user purchase behavior by adopting a classification approach Implement data mining techniques to discover items that are frequently purchased together Group similar text documents by using various clustering methods ",R for Data Science Solutions,3.2
https://www.udemy.com/course/data-science-complete-guide-course/,"Understanding the Key Concepts Learn and Understand Python Pandas Learn and Understand Bokeh Learn How to Manage Packages Machine Learning With Scikit-Learn Learn How to Analyze your data efficiently with the most powerful data science stack Learn How to Perform cleaning, sorting, classification, clustering, regression, and dataset modeling using Anaconda ",Data Science – The Complete Guide (incl. Python & R),3.2
https://www.udemy.com/course/hadoop-datascience-nlp-all-in-one-course/,"You will be able to develop a real world an end to end application which will encompass both Hadoop as well as Natural Language Processing (Data Science). Setup a Hadoop Cluster on your laptop free of cost and then connect to different hadoop services. Develop distributed applications based on Hadoop Framework, Different Hadoop pillars, HDFS Architecture, MapReduce and different types of Data in Hadoop. Visualize Hadoop ecosystem services as well as components like Memory usage, Cluster Load etc. in the form of dashboard on a Web Interface called Ambari. Design and Develop scalable, fault tolerant and flexible applications which can store and distribute large data sets across inexpensive servers. Develop scripts based on several commands in Hadoop to manage files and datasets. Understand the different building blocks of Apache NIFI helping in data movement, transformation etc. Also learn about NIFI Architecture and its various applications. Steps to Install Apache NIFI and making changes in configuration files to run it seamlessly. Develop a complete workflow application in NIFI which can take data from the streaming source, perform transformations on this data and then store it in Hadoop. Spin up Apache Solr as one of the service, configure it to receive streaming data from NIFI processor to perform real time analytics on this data. Understand the architecture and concepts related to Apache Solr as well as several of its features. Create a Banana Dashboard to visualize the real time analytics happening on live streaming data after getting an understanding of components and structure of Banana Dashboard. Visualize where does Hive fit in Hadoop Ecosystem, its Architecture as well as how exactly it works. Develop an understanding of how data can be stored in structured form in Apache Hive. In depth knowledge of several of its components. Develop and Visualize the data in the form of Graphs, Histograms, Pie Charts etc. using another Hadoop Ecosystem tool (notebook) called Apache Zappelin. Develop the concepts of Natural Language Processing and integrate them all to develop a working NLP application. Develop basic building blocks of Natural Language Processing and write associated python scripts. Build a machine learning model using Python for the application going to be built. ",Hadoop & Data Science NLP (All in One Course).,3.1
https://www.udemy.com/course/intuitive-sql-databases-case-study/,"Create a table Insert values into it Use and understand some data types Use SELECT statements UPDATE records Use some aggregate functions like COUNT(), MIN(), SUM() Use WHERE clause Remove a character from a string Cast a string to numeric values Write subquery Retrieve the top and bottom candidates Add a column Do a for loop Make a histogram Use DELETE clause Use IN operator ",Intuitive SQL Databases Case Study,3.8
https://www.udemy.com/course/data-scientist/,,Data Scientist Terminology Prep,3.1
https://www.udemy.com/course/tableau-complete-course/,"Build visualization, organize data and design dashboards Create interactive and shareable dashboards Learn about Data blending, Charts and Graphs Connecting data with servers, connect and join data Advanced visualizations like Gantt Charts, Tree maps, Area & pie charts, box and whisker plots, scatter plot Row level and Aggregate calculations Table calculations Formatting a visualization Structuring data and advanced visualizations Sparklines, Dumbell, Lollipop, Slope and Water Chart Sharing data story Tableau Online ",Tableau in Practice - A Step by Step Complete Course,3.1
https://www.udemy.com/course/machine-learning-with-python-data-science-for-beginners/,"Master Machine Learning using Python Demystify Artificial Intelligence, Machine Learning, Data Science ML Business Solution Blueprint Explore Spyder, Pandas and NumPy Implement Data Engineering and Data Analysis Introduction to Statistics and Probability Distributions Understand Supervised and Unsupervised Learning Implement Simple & Multiple Linear Regression Regression & Classification Model Evaluation Cross Validation, Hyperparameter, Ensemble Modeling, Random Forest & XGBoost ",Machine Learning with Python: Data Science for Beginners,3.1
https://www.udemy.com/course/data-science-with-spark/,Understand the Spark programming language and its ecosystem of packages in Data Science Obtain and clean data before processing it Understand the Spark machine learning algorithm to build a simple pipeline Work with interactive visualization packages in Spark Apply data mining techniques on the available data sets Build a recommendation engine,Data Science with Spark,3
https://www.udemy.com/course/dp-100-designing-and-implementing-a-data-science-solution/,,DP-100 Designing and Implementing a Data Science Solution,2.8
https://www.udemy.com/course/getting-started-with-r-for-data-science/,"Write R code that can be executed outside RStudio Get data from numerous sources such as files, databases, and even Twitter Clean data before the analysis phase begins Load libraries into RStudio for use within the analysis phase Perform data cleaning on a dataset Create a codebook so that the data can be presented in a summary Understand how to use visualization to understand data and tell a story ",Getting Started with R for Data Science,3.4
https://www.udemy.com/course/introduction-to-r-programming-must-see-introduction-to-r/,Get an overview of what R is Pursue a Learning Path in Data Science in R Get a tour of the kinds of projects that can be done with R Programming Get Resources and Data Sets to Practice their R Skills on Understand the different components that comprise of R Programming,Introduction to R Programming - Must See Introduction to R,3
https://www.udemy.com/course/step-by-step-machine-learning-with-python/,"Exploit the power of Python to handle data extraction, manipulation, and exploration techniques Use Python to visualize data spread across multiple dimensions and extract useful features Delve into the world of analytics to predict situations correctly Implement machine learning classification and regression algorithms from scratch in Python Be amazed to see algorithms in action Evaluate the performance of a machine learning model and optimize it Solve interesting, real-world problems using machine learning and Python as the journey unfolds ",Step-by-Step Machine Learning with Python,3.9
https://www.udemy.com/course/discrete-optimization/,"What is optimization Some real-life situations where we need to optimize an objective The mathematical formalism of optimization How discrete optimization (Combinatorics) differs from continuous optimization Different approaches to solve a Combinatorics problem, including— The simplest, perfect but slow ‘Brute Force’ method. One of the fastest and practicable ‘Greedy’ heuristic.A look-ahead mechanism to refine the greedy approach. The most popular problem in Combinatorics, viz. Travelling Salesman Problem Other generic problems in discrete optimization, like the Knapsack Problem How metaheuristic approaches compare to heuristic solutions The nature-inspired class of metaheuristic approaches Ant Colony Optimization: its basis, modus operandi, algorithm and flow chart The R library to implement Ant Colony Optimization and other heuristic solutions Examples of Travelling Salesman Problems solved through different approaches ",Discrete Optimization Data Science Heuristic & Metaheuristic,3.8
https://www.udemy.com/course/data-science-for-interviews/,You will be able to have a better grasp over data science concepts and you will be able to clear all your interviews and land the perfect 'Data Science' job.,Data Science for Interviews,3.4
https://www.udemy.com/course/datasciencemicroservices/,Generate an application with microservices that does Machine Learning predictions.,Microservices introduction for Data Science,3.2
https://www.udemy.com/course/microsoft-dp-100-practice-test-questions/,,"DP-100: Designing and Imp. a Data Science Solution, Test",2.6
https://www.udemy.com/course/hands-on-fundamentals-of-data-science-with-go/,Perform data collection and use statistical models to perform data visualization in Go. Clean and filter data for data formatting. Implement models like Naïve Bayes to work efficiently with high speed in Go. Build an end-to-end model like Regression to analyze new data. Solving predictive analytics through decision trees model. Practical coverage on how to build data science pipeline in Go Explore how Go code differs with Python,Hands-On Fundamentals of Data Science with Go,3.1
https://www.udemy.com/course/learning-path-r-real-world-data-science-solutions-with-r/,"Get data from numerous sources such as files, databases, and even Twitter Perform data cleaning on a dataset Create a codebook so that the data can be presented in summary Implement simple R instructions to quickly organize and manipulate large datasets Create professional data visualizations and interactive reports Implement data mining techniques to discover items that are frequently purchased together Group similar text documents by using various clustering methods Produce high-quality statistical graphics Use functional programming and meta-programming to fasten data analysis code ",Learning Path: R: Real-World Data Science Solutions with R,3.6
https://www.udemy.com/course/applied-data-science-multiple-linear-regression-in-r/,"In this course you will learn how to build a time series forecasting model using Multiple Linear Regression (MLR), this means that you will learn the assumptions of MLR i.e. some Statistics concepts. You will also learn how to turn your Data Science Skills into useful business solutions by applying some concepts from demand Economics i.e. You will learn how Business knowledge or Domain knowledge fits into Data Science. You will learn all the R code needed to build a MLR algorithm for forecasting. You will learn all the R code needed to build a MLR algorithm for forecasting. ",Business Data Science: Time Series Regression,3.9
https://www.udemy.com/course/statistics-for-data-science-using-python/,"Learn statistical concepts that are very important to Data science domain and its application using Python. Learn about Numpy, Pandas Data Frame ",Statistics for Data Science using Python,2.5
https://www.udemy.com/course/learn-data-science-with-python-part-1-python-basics/,"How to setup a Python development environment using Anaconda & Jupyter Notebooks How to get started with Jupyter Notebooks for Python development Learn to basic Python concepts such as creating and running your first program Learn to use Python in lists, which is the first step to efficiently working with huge amounts of data. Learn how to use code written by other Python developers Learn to use Python NumPy package which is the entry knowledge to becoming a data scientist ",Learn Data Science with Python - Part 1: Python Basics,3.3
https://www.udemy.com/course/data-science-with-python-for-people-in-a-hurry/,Understand the Basics of Data Science. Learn how to debug and fix machine learning models. Know and understand how to use popular data science tools.,Data Science with Python for People in a Hurry.,3.7
https://www.udemy.com/course/learning-path-spark-data-science-with-apache-spark/,Understand the Spark API and its architecture Know the difference between RDD and the dataframe API Discover how to write efficient jobs using Apache Spark Learn to test Spark code correctly Understand the Spark programming language and its ecosystem of packages in Data Science Learn Spark machine learning algorithm to build a simple pipeline Apply data mining techniques on the available data sets Build a recommendation engine,Learning Path: Spark: Data Science with Apache Spark,3.3
https://www.udemy.com/course/learn-python-for-data-science-with-googles-colab/,Gain the skills to independently write real world programs in python. Learn to perform various batch operations. Brief overview of data science. Colab notebook environment. Designing of Reusable Object-Oriented Python Classes. Vocabulary related to python. Object attributes and methods.,Learn Python for Data Science with Google's Colab,3.7
https://www.udemy.com/course/complete-mysql-for-data-science-and-business-intelligence/,Write Queries for MySQL Database Use Python 3 Programs to connect to MySQL and run queries programatically Write complex queries for Data Science Use cases and applications Confidently work with SQL on any Relational DBMS Add SQL for Data Science in your professional resume Appear confidently for interviews,Complete MySQL for Data Science and Business Intelligence,3.4
https://www.udemy.com/course/polling-data-analysis-in-mapreducepig-and-hive-bigdata/,Students will be able to learn how Big-Data/Hadoop is effective in Real Industry Scenario. learn about application of Hadoop technologies and how to work on the data sets with ease in particular. We are going to learn about -Analyze country sensor data for its development Using Hadoop.,"Polling Data Analysis in MapReduce,PIG and HIVE - BigData",3.3
https://www.udemy.com/course/kaggle-masterclass/,Machine Learning Deep Learning Data Analytics Exploratory Data Analysis Kaggle Data Science,Kaggle Masterclass - build a Data Science Portfolio,3.2
https://www.udemy.com/course/statistics-for-data-science/,"Analyze the transition from a data developer to a data scientist mindset Get acquainted with R programs and the logic used for statistical computations Understand mathematical concepts such as variance, standard deviation, probability, matrix calculations, and more Learn to implement statistics in data science tasks such as data cleaning, mining, and analysis Learn the statistical techniques required to perform tasks such as linear regression, regularization, model assessment, boosting, SVMs, and working with neural networks Get comfortable with performing various statistical computations for data science programmatically ",Statistics for Data Science,2.4
https://www.udemy.com/course/datamining/,"Use real world examples of data mining and datasets. Practice for real world projects such as: learn how to find data on a house when looking to become a homeowner. You will be able to look through house data to find useful information from a text dataset. Clean data, filter noise, make data available for analysis. Perform cluster analysis, classification and regression, including logistic regression Use the K-NN classifier and SVM. Detect outliers in univariate, multivariate and high dimensional spaces Learn how to use Apache Spark, the number one framework used for distributed processing. And many more topics explained with concrete examples. ",Data Mining with Python! Real-Life Data Science Exercises,3
https://www.udemy.com/course/data-science-in-cybersecurity-case-studies/,Hands-on of Machine Learning in Cybersecurity Supervised and unsupervised machine learning models for cybersecurity,Cybersecurity with Data Science: Implementation,2.2
https://www.udemy.com/course/learn-sql-from-basic-to-intermediate-by-projects/,What is database What is a table SQL create database and create table SQL Schema definition SQL basic Syntax SQL selection query SQL select with condition SQL import data from csv SQL aggregation functions SQL nested queries SQL alter table,SQL for Data Science from Basic to Intermediate By Projects,2.8
https://www.udemy.com/course/complete_python_datascience_masterclass/,Become a professional python programmer Learn advanced python features Master data science from zero to hero Learn Deep Learning from the ground up Master Machine Learning Create Python GUI Applications like a Pro Master Jupyter-Notebook Learn Object Oriented Programming in Python Learn Array Oriented Programming in Python Learn NLP ( Natural Language Processing ) in Python Learn to create games with python Master Big Data,The Python Developer Course™: Master Python 3 & Data Science,3.5
https://www.udemy.com/course/jupyter-for-data-science/,"Understand why Jupyter Notebooks are a perfect fit for your data science tasks Perform scientific computing and data analysis tasks with Jupyter Interpret and explore different kinds of data visually with charts, histograms, and more Extend SQL's capabilities with Jupyter Notebooks Combine the power of R and Python 3 with Jupyter to create dynamic notebooks Create interactive dashboards and dynamic presentations Master the best coding practices and deploy your Jupyter Notebooks efficiently ",Jupyter for Data Science,2
