,Job_Title,Company_Name,Location,Compensation,Job_ID,Job_Description,Employment_Type,Pay_Type,Pay_Rate,Store_Type,Other_Compensation,Python,R ,Matlab,Excel,SAS,SQL,SPSS,Hadoop,Spark
11,Sr--Financial-Analyst-Amazing-Opportunity--Luv-,Robert Half Finance & Accounting U.S,GA - Atlanta,$75k - $85k/year,00900-0010911307,"Ref ID: 00900-0010911307Classification: Sr. Financial AnalystCompensation: $75000.00 to $85000.00 yearlyWe have been engaged by a industry leading company headquartered in Atlanta in its targeted search for an experienced Senior Financial Analyst. This role will be work with all facets of the business. Sr. Financial Analyst and reporting to the Finance ManagerResponsibilities will include: The Senior Analyst, Financial Planning, Analysis and Reporting will, develop and support complex financial and operational objectives (i.e. reporting, financial planning) and/or strategy. This role will also work collaboratively with other business units/departments to develop actions plans to support specific business objectives as well as develop financial forecasts to in support of overall company objectives. The Senior Analyst is responsible for critical and complex analysis, and reporting of financial and operational resultsPrepare monthly financial reporting package for the company, providing detailed business explanations behind variances against forecast, budget and prior year for Income Statement, Balance Sheet and Cash Flows. Gather data and perform analytical review of actual results versus budget, forecast, and prior year at varying levels of the organization and across different information systems for functions and business segments.Prepare, review and present financial projections and recast financial statements, provide variance analysis, research financial irregularities and use the analysis to develop meaningful financial reporting.Analyze financial performance, prepare monthly variance to forecasts and present recommendations to business unit management and operators. Develop, prepare and present specialized reports, forecasts, profitability analysis, pricing analysis, other ad-hoc projects and complex financial models.Track key performance indicators and provide analysis to support business decisions. Analyze and report on financial and/or operational results/analysis. Ensure historical information, current trends, regulatory environment and tax consequences are factored into analysis. Deliver ad hoc analytical projects to provide insights as required with focus on meeting deadlines and providing communication to management. Provides support to Senior Management including financial presentation and analysis. Assist in the coordination and analysis of recurring internal management reporting (Flash Financial Reporting, Operation Metric Reporting, etc.), the rolling forecast process, the Annual Operating Plan, and the Strategic Plan.Prepare presentations to highlight financial trends, summarize business plans, and communicate process changes across the enterprise.Identify and implement improvements across financial reporting processes.Analyze data and provide solutions/recommendations in response to anticipated and unanticipated fluctuations in the company’s business.Support the annual budget process including creation of financial models and budget presentation and explanation.Provide support for essential business improvement and corporate strategy projects.Enhance the content and create intuitive designs/layouts for company financial presentations.Only qualified candidates will be contacted and considered; please no phone callsIf you are interested in this opportunity with a growing organization please send resume to Luv Mirani at [Click Here to Email Your Resumé]Qualified Candidates will:Have a Bachelor of Science degree in Finance, Business, Accounting or EconomicsBachelor's degree (Finance or Accounting preferred) or equivalent experience. Have A minimum of 2+ years of financial/analytical experience, along with experience at leading financial analysis projects preferred. Have Strong analytical skills and comfortable with large, complex data sets, legacy systems etc. Advanced Excel user including Pivot tables – Macros is a plusProficiency with PowerPoint to present financial models and forecastsExperience initiating and leading projects and ability to work with senior managers and key stakeholders in Corporate and Business Unit Departments. Must have a solid understanding of accounting knowledge/skills. Demonstrated leadership skills and experience in managing goals through collaboration and teamwork and leading financial reporting, financial variance analysis, product line analytics, and product development analyses, and close processHave good written and verbal communication skillsStrong interpersonal and oral/written/presentation communication skills required.Only qualified candidates will be considered and contacted. Please no phone callsClient is ready to hire asap!!!! For immediate and confidential consideration, please send resumes to Luv Mirani at [Click Here to Email Your Resumé]Robert Half Finance & Accounting, the world's leader in specialized financial staffing, provides exciting full-time opportunities in the areas of accounting, bookkeeping, finance, audit, taxation and more. We pioneered the professional staffing industry, and we've been successfully matching professionals with employers since 1948. Our proven proprietary processes, along with our relationships in 325 locations worldwide, allow us to provide you unparalleled access to exciting career opportunities. But don't take our word for it. Our company has appeared on Fortune® magazine’s list of “World's Most Admired Companies” since 1998, and 9 out of 10 of our customers would recommend our service to a colleague. Apply for this job now or contact our nearest office at 888.490.5461 for additional information. All applicants applying for U.S. job openings must be authorized to work in the United States. All applicants applying for Canadian job openings must be authorized to work in Canada.© 2019 Robert Half Finance & Accounting. An Equal Opportunity Employer M/F/Disability/Veterans.By clicking 'Apply Now' you are agreeing to Robert Half Terms of Use.Location US-GA-AtlantaEmployment Type Full-TimePay Type YearPay Rate $75,000.00 - $85,000.00 /YearStore Type Accounting,  Finance",Full-Time,Year,"$75,000.00 - $85,000.00 /Year","Accounting,  Finance",NA,,,,,,,,,
12,Sr--Biomarker-Scientist,Aerotek,PA - Philadelphia,N/A,NA,"We use relevant biomarkers for patient selection, patient monitoring (response and safety) and long-term follow-up of the patients. Our team is responsible for designing and implementing biomarker and companion diagnostic strategies, designing and implementing biomarker assays into clinical studies, interpreting biomarker data and developing companion diagnostic (CDx) assays, and in collaboration with our regulatory team, supports filing and registration activities.Thus, we are seeking a highly motivated biomarker scientist to provide assay support for our clinical programs in oncology. The Clinical Biomarker Scientist will be responsible for developing and validating biomarker assays with external CLIA-certified laboratories, and subsequently implementing testing into clinical trials. Success in this role requires a thorough understanding of CLIA-grade assay validation (protein-biochemistry and molecular-based assays), and an ability to effectively manage external contract laboratories.The position requires working in close partnerships across various functions including Preclinical Research, Translational Sciences, Clinical, Biometrics, and Regulatory. In addition, the individual is expected to establish and manage productive external vendor collaborations. Effective communication is essential and can include presentations at cross-functional teams and internal review committees. Implementation of biomarker and CDx strategies into clinical studies also requires knowledge of biospecimen collection procedures.ESSENTIAL JOB FUNCTIONSAccountable for clinical biomarker assay and clinical trial assay development and validation, as well as implementation and management of testing within clinical trialsResponsible for the successful execution of the biomarker assay development plan, including but not limited to external contract laboratory (CLIA-certified) selection, assay contract setup, analytical and communication plan preparation, database design and maintenance, logistics, and access to test resultsDesign and oversee fit-for-purpose assay validationReview assay method procedures, validation reports and clinical sample analysis summary reportsManage out-sourced testing and ensure the quality, timelines and budget are metResponsible for writing and review of biomarker sections of clinical trial documents such as clinical trial protocols, informed consents, study procedures manuals, vendor requisition forms, eCRFs, investigator brochures, and clinical study reportsResponsible for authoring components of regulatory submissions such as Significant Risk Determination (SRD) and Investigational Device Exemption (IDE) applications, IDE Annual Reports, and Briefing Documents for Regulatory AuthoritiesSupport CDx assay developmentEDUCATION, SKILLS, AND EXPERIENCEA minimum of a Masters degree with at least 4 years of combined academic institute/pharmaceutical industry experience OR a PhD in a scientific discipline (e.g. Cancer Biology, Immuno-oncology, Biomedical Science or Pharmacology) with at least 2 years of additional research or industry experienceKnowledge of drug discovery and development or translational medicineExperience implementing biomarkers in a clinical settingDirect experience in development, outsourcing and validation of clinically applicable biomarker assays in CLIA labs is requiredExperience authoring SRD and IDE applications is requiredGood understanding of GLP/GCP/ICH guidelines, CLIA regulations, and regulatory requirementsExperience with IHC, ELISAs, and protein assays is requiredA strong applicant will also have experience with gene expression assays, qPCR, NGS, etc.Understanding of development of a CDx a plusDirect laboratory experience with human tissue specimens (blood, tumor etc.) is requiredSelf-motivated, proactive, and able to prioritize and manage multiple projects simultaneouslyMust have excellent written and verbal communication and interpersonal skills and must be able to operate in a fast paced and dynamic environmentAbout Aerotek: We know that a company's success starts with its employees. We also know that an individual's success starts with the right career opportunity. As a Best of Staffing® Client and Talent leader, Aerotek's people-focused approach yields competitive advantage for our clients and rewarding careers for our contract employees. Since 1983, Aerotek has grown to become a leader in recruiting and staffing services. With more than 250 non-franchised offices, Aerotek's 8,000 internal employees serve more than 300,000 contract employees and 18,000 clients every year. Aerotek is an Allegis Group company, the global leader in talent solutions. Learn more at Aerotek.com.The company is an equal opportunity employer and will consider all applications without regards to race, sex, age, color, religion, national origin, veteran status, disability, sexual orientation, gender identity, genetic information or any characteristic protected by law.If you would like to request a reasonable accommodation, such as the modification or adjustment of the job application process or interviewing process due to a disability, please call 888-237-6835 or email accommodation@aerotek .com for other accommodation options. However, if you have questions about this position, please contact the Recruiter located at the bottom of the job posting. The Recruiter is the sole point of contact for questions about this position.                   Location US-PA-PhiladelphiaEmployment Type Full-TimePay Type YearPay Rate N/AStore Type Biotech",Full-Time,Year,N/A,Biotech,NA,,,,,,,,,
13,Clinical-Project-Manager,Aerotek,MD - Rockville,$0 - $1k/year,NA,"Our client is looking for a Clinical Project Manager who will independently lead the study team in the development and execution of complex clinical trials. The ideal candidate will be accountable, globally, to deliver clinical milestones on trial(s) with quality, on time, and within scope and budget. The CPM will consistently demonstrate leadership and influence when working with study teams, management, and business partners. The candidate will work with diverse teams to apply creative solutions to complex and key technical operational or business problems. This will include opportunities to work with vendors, affiliates/regions, global teams, and other business partners.* Lead, influence and project manage large, complex studies and/or multiple smaller studies that deliver positive patient and investigator site experiences and quality data.* Partner with other organizations to oversee and actively participate in Investigator Study Specific Training (ISSTs)/ Affiliate Study Training (ASTs).* Be accountable for enrollment strategy * Accountability for trial documentation and ensuring inspection readiness of respective clinical trial(s) at all times. This includes timely documentation of deviations, creation of storyboards or issue summary documents (e.g. for high risk areas/hot topics) and coaches others CTPMs and study team in these activities.* Lead vendor (including CRO) qualification process, selection, and oversight.* Apply expertise and knowledge of global/regional regulations, Good Clinical Practice (GCP) and Company standards of operation in the conduct of clinical trials.* Provides operational and strategic input and/or approves study documents such as synopsis, protocol, ICF, CRFs, CRF Completion Guidelines, Study Plans, Laboratory Manual, Patient Diary, Study Reference binders, Pharmacy Manual, Clinical Data Review Plan, Clinical Database specifications development, Clinical Study Report (CSR) development, etc.* Responsible for management of data management and clinical operations teams in review of clinical data; provides guidance on issues/queries as needed and implements risk management concepts as appropriate* Oversees/responsible for the TMF set-up, ongoing quality review and final reconciliation of study documents including review of site regulatory documents/packages.* Conducts Sponsor quality monitoring/oversight visits to sites and/or CRAs performance assessment in adherence to GCP, corporate SOPs and protocol as needed.* Creates, manages, measures, and reports timelines for milestone deliverables.* Prepares metrics and updates for management.* Utilize expertise to make timely decisions for ambiguous and complex situations. Uphold a consistent, solution-focused approach to conducting daily business.* Recognize inter-relatedness of cross-study team activities and understand the impact of project decisions on the overall clinical trial. Look for opportunities to expand and deepen clinical trial process expertise across study teams and external partners and make decisions on process and issues affecting study implementation and execution.* Network and apply expertise to anticipate trial and regional issues, identify areas of process breakdown, analyze situations and propose innovative approaches that positively impact ability to deliver while reducing and/or mitigating risks.* Proactively manages/identifies potential study issues/risks and recommends/implements solutions with key internal/external stakeholders.* Contribute to the development of others by acting as a coach for peers as well as new CTPMs, study team members and business partners on aspects of CT process and regional specificities while maximizing shared learning.* Identify and lead process improvement activities. Acts as an expert resource to peers and in the development and rollout of new tools, processes or methodologies to proceed as quickly as the science allows.* Utilize and demonstrate broad understanding of therapeutic, clinical drug development, and process expertise in order to influence study design and program-level decisions considering customer needs.This Position a fully In House opportunity, 5 days a week in the office. About Aerotek:We know that a company's success starts with its employees. We also know that an individual's success starts with the right career opportunity. As a Best of Staffing® Client and Talent leader, Aerotek's people-focused approach yields competitive advantage for our clients and rewarding careers for our contract employees. Since 1983, Aerotek has grown to become a leader in recruiting and staffing services. With more than 250 non-franchised offices, Aerotek's 8,000 internal employees serve more than 300,000 contract employees and 18,000 clients every year. Aerotek is an Allegis Group company, the global leader in talent solutions. Learn more at Aerotek.com.The company is an equal opportunity employer and will consider all applications without regards to race, sex, age, color, religion, national origin, veteran status, disability, sexual orientation, gender identity, genetic information or any characteristic protected by law.If you would like to request a reasonable accommodation, such as the modification or adjustment of the job application process or interviewing process due to a disability, please call 888-237-6835 or email accommodation@aerotek .com for other accommodation options. However, if you have questions about this position, please contact the Recruiter located at the bottom of the job posting. The Recruiter is the sole point of contact for questions about this position.                   Location US-MD-RockvilleEmployment Type Full-TimePay Type YearPay Rate $0.00 - $1,000.00 /YearStore Type Biotech,  Pharmaceutical,  Research",Full-Time,Year,"$0.00 - $1,000.00 /Year","Biotech,  Pharmaceutical,  Research",NA,,,,,,,,,
14,Quality-Control-Manager,Aerotek,CA - Pasadena,$90k - $125k/year,NA,"Now hiring a Quality Control Manager in Pasadena, CA!General Job Description: As part of a talented and multi-disciplinary team advancing an exciting new approach to drug discovery, development and manufacturing, the successful candidate will lead all areas of Quality Control providing support to the GMP Manufacturing team and Process Development and our clinical programs. The key deliverables are in-process and final product testing, stability testing for DS and DP, assay development and assay qualification, clinical research assays, the implementation of a raw materials program, environmental monitoring, and authoring of SOPs and STM's. Other responsibilities include supporting IQ/OQ activities for QC equipment, establishing operational policies and procedures, and many other activities to ensure a successful QC Analytical and QC Micro labsPrimary Duties and Responsibilities include but are not limited to: Manage the QC group to maintain a functional lab, monitor and reinforce the compliance in the lab. Oversee analysts training program. Work with analysts to further develop each to achieve their career goals. Direct the development of QC departmental strategies and objectives. Oversee product release and stability testing. Work with QA to get the product dis-positioned. Oversee stability program. Oversee the method development and qualification for analytical and cell-based assays. Author and approve development/qualification protocols, reports and data summaries, and oversee the deviations/OOSs at CROs and CTLs. Administrate the raw material program, cross function with Manufacturing and QA departments to ensure the raw materials get dis-positioned for the manufacture process.Guide/lead the QCA analysts on all trouble shooting and OOS projects. Author and approve OOS/investigation reports for analytical and cell-based assays. Oversee all GMP equipment sourcing/purchasing/validation processes. Work with FAC and vendors to ensure all GMP equipment is being calibrated, qualified and PM'd. Oversee and manage the outsourced testing activities. Identify appropriate CTLs to cover the outsourced testing activities.  Perform assays when needed. Assist in preparation of regulatory submission. Perform all activities in accordance with safety, cGMPs and company procedures. Perform other related duties and responsibilities as assigned.Requirements:-Bachelor's degree or higher in Life Science, Chemistry, Biology, or other related discipline-8+ years in quality control in cGMP operations preferably in a biotechnology or pharmaceutical industry-3+ years of management experience in cGMP operations preferably in a biotechnology or pharmaceutical industry (must have PCR and Cell Assay experience)-Experience with method development and qualification for analytical and cell-based assays.-Experience with author and approve development/qualification protocols, reports and data summaries, and oversee the deviations/OOSs at CROs and CTLs.Salary: $90,000-$125,000 DOEAbout Aerotek: We know that a company's success starts with its employees. We also know that an individual's success starts with the right career opportunity. As a Best of Staffing® Client and Talent leader, Aerotek's people-focused approach yields competitive advantage for our clients and rewarding careers for our contract employees. Since 1983, Aerotek has grown to become a leader in recruiting and staffing services. With more than 250 non-franchised offices, Aerotek's 8,000 internal employees serve more than 300,000 contract employees and 18,000 clients every year. Aerotek is an Allegis Group company, the global leader in talent solutions. Learn more at Aerotek.com.The company is an equal opportunity employer and will consider all applications without regards to race, sex, age, color, religion, national origin, veteran status, disability, sexual orientation, gender identity, genetic information or any characteristic protected by law. We will consider for employment all qualified applicants, including those with criminal histories, in a manner consistent with the requirements of applicable state and local laws, including the City of Los Angeles' Fair Chance Initiative for Hiring Ordinance.If you would like to request a reasonable accommodation, such as the modification or adjustment of the job application process or interviewing process due to a disability, please call 888 472-3411 or email accommodation@teksystems .com for other accommodation options.                   Location US-CA-PasadenaEmployment Type Full-TimePay Type YearPay Rate $90,000.00 - $125,000.00 /YearStore Type Biotech",Full-Time,Year,"$90,000.00 - $125,000.00 /Year",Biotech,NA,,,,,,,,,
