,Job_Title,Company_Name,Location,Compensation,Job_ID,Job_Description,Employment_Type,Pay_Type,Pay_Rate,Store_Type,Other_Compensation,Python,R ,Matlab,Excel,SAS,SQL,SPSS,Hadoop,Spark
0,Senior-Data-Scientist,Robert Half Technology,TX - Fort Worth,N/A,04030-0011057821,"Ref ID: 04030-0011057821Classification: Data ScientistCompensation: DOERobert Half Technology is looking for a Senior Data Scientist. This Senior Data Scientist is a direct hire, FTE (Full Time Employment) position with one of our client companies in the DFW area. For immediate and confidential consideration on this Permanent / Direct hire IT opportunity, please e-mail your resume confidentially to [Click Here to Email Your Resumé] (profile also on LinkedIn.) Summary-Are you motivated to contribute to the digital transformation of a successful company? This is a unique opportunity to be at the forefront of using decision sciences and implement your solutions in production and have an impact on the business. As a deep domain expert, you will work on great projects and develop applications that will contribute to the value our client delivers to its customers. You should hold an MS or a PHD with a major in operations research, applied statistics, computer science or machine learning.The Senior Data Scientist will design, develop and implement valuable business solutions for the organization by preparing and cleaning data, designing and coding decision support systems and measuring performance of the recommended decisions. These applications will identify business trends and opportunities using advanced decision science. The candidate will interpret data from multiple sources using a variety of statistical and complex data mining techniques in order to provide guidance to the business and contribute to the value our client delivers to its customers.Primary Responsibilities- -Design and develop decision support systems from the ground up that will improve business effectiveness and performance.-Analyze and interpret results from multiple sources using a variety of techniques, ranging from simple data clustering to more advanced classification problem using supervised learning techniques with cross validation.-Prepare big data, implements data models and develops database to support the business solutions.-Coordinate and communicating effectively across diverse functional teams (business leaders and technical teams) the applied logic as well as the data and the information used.-Prepare high-level and detail-level project plans and ensure that each project objective is being completed within the agreed upon deadlines.                  Required Skills & Experience--Master’s Degree in applied statistics, computer science, or related field of study required. Minimum of three years work experience in a big data environment.-Hands-on technical and functional experience in building predictive modeling, decision support systems and datamining analysis in a big data environment-Experience in software engineering-Deep knowledge of Python programming, Python libraries such as Pandas, NumPy, Scipy, PyBrain, etc-Solid experienced with SQL and writing procedures-Knowledge of R programming and prototyping-Knowledge of Operations Research and decision sciences with the following:-Forecasting (Consumer Choice Modeling (Logit regression), time series, ANOVA, etc.)-Segmentation models (CART, random forest, decision tree, etc.)-Machine learning and deep learning (reinforcement learning)-Pricing analytics and revenue management (dynamic pricing, revenue optimization, price testing, etc.)-Experience in problem solving and delivering workable solutions-Team player who enjoys working in a collaborative, agile environment-Good communication skills with the ability to explain the significance of data in a way that can be easily understood by others-Strong attention to detail, proficient organizational skills-Very high initiative and drive for organizational successFor immediate and confidential consideration on this Permanent / Direct hire IT opportunity, please e-mail your resume confidentially to [Click Here to Email Your Resumé] (profile also on LinkedIn.)Technology doesn't change the world. People do. As a technology staffing firm, we can't think of a more fitting mantra. We're extreme believers in technology and the incredible things it can do. But we know that behind every smart piece of software, every powerful processor, and every brilliant line of code is an even more brilliant person. Leader among IT staffing agencies The intersection of technology and people — it's where we live. Backed by more than 65 years of experience, Robert Half Technology is a leader among IT staffing agencies. Whether you're looking to hire experienced technology talent or find the best technology jobs, we are your IT expert to call. We understand not only the art of matching people, but also the science of technology. We use a proprietary matching tool that helps our staffing professionals connect just the right person to just the right job. And our network of industry connections and strategic partners remains unmatched. Apply for this job now or contact our branch office at 888-490-4429 to learn more about this position. All applicants applying for U.S. job openings must be authorized to work in the United States. All applicants applying for Canadian job openings must be authorized to work in Canada. © 2019 Robert Half Technology. An Equal Opportunity Employer M/F/Disability/Veterans. By clicking 'Apply Now' you are agreeing to Robert Half Terms of Use.Location US-TX-Fort WorthEmployment Type Full-TimePay Type YearPay Rate N/AStore Type Engineering,  Information Technology,  DesignOther Compensation: DOE",Full-Time,Year,N/A,"Engineering,  Information Technology,  Design",DOE,,,,,,,,,
1,Senior-Data-Scientist,Robert Half Technology,NJ - Jersey City,$140k - $160k/year,02710-0011220068,"Ref ID: 02710-0011220068Classification: Data ScientistCompensation: $140000.00 to $160000.00 yearlyThe Sr Manager/Director, Data Science will be responsible for helping develop the companies data science strategy, building decision systems with machine learning and surfacing company-wide actionable insights to drive business growth. This position is ideal for someone who enjoys elevating the way decision are made and data is used at a fast-paced, consumer-facing company. A successful candidate will enjoy researching and developing statistical learning models, collaborating with various stakeholders to understand company needs / devise solutions and helping implement data driven strategies that impact business profitability. This is a multifaceted opportunity allowing the Manager to deliver unique value propositions to the companies base of clients. Duties/Responsibilities: Help define, lead and own data science strategy, including tools and team Apply artificial intelligence and machine learning techniques to solve complex problems, including customer segmentation, product propensity, operational performance and fraud Research and develop statistical frameworks to optimize product performance through A/B testing and variance analysis Lead analysis for strategic data initiatives and present findings and recommendations to executive leadership Oversee implementation of data insights into the business and ensure analytic integrity Partner with departments to resolve their data and analytical needs Manage scheduled and ad-hoc analytics/data project                  Bachelor's Degree required (Masters or PhD in quantitative discipline preferred)4+ years of relevant experience in Data ScienceHigh degree of comfort with statistical modeling, scenario analysis, working with high volumes of data and building analyses from the ground upHighly proficient in Python or R; SQL a plusExperience working with executive leadership and other internal and external partnersExperience infusing enterprise BI/dashboards/reports with DS/ML intelligence***For immediate consideration, please send an updated resume with salary requirement to [Click Here to Email Your Resumé] ***Technology doesn't change the world. People do. As a technology staffing firm, we can't think of a more fitting mantra. We're extreme believers in technology and the incredible things it can do. But we know that behind every smart piece of software, every powerful processor, and every brilliant line of code is an even more brilliant person. Leader among IT staffing agencies The intersection of technology and people — it's where we live. Backed by more than 65 years of experience, Robert Half Technology is a leader among IT staffing agencies. Whether you're looking to hire experienced technology talent or find the best technology jobs, we are your IT expert to call. We understand not only the art of matching people, but also the science of technology. We use a proprietary matching tool that helps our staffing professionals connect just the right person to just the right job. And our network of industry connections and strategic partners remains unmatched. Apply for this job now or contact our branch office at 888-490-4429 to learn more about this position. All applicants applying for U.S. job openings must be authorized to work in the United States. All applicants applying for Canadian job openings must be authorized to work in Canada. © 2019 Robert Half Technology. An Equal Opportunity Employer M/F/Disability/Veterans. By clicking 'Apply Now' you are agreeing to Robert Half Terms of Use.Location US-NJ-Jersey CityEmployment Type Full-TimePay Type YearPay Rate $140,000.00 - $160,000.00 /YearStore Type Engineering,  Information Technology,  Design",Full-Time,Year,"$140,000.00 - $160,000.00 /Year","Engineering,  Information Technology,  Design",NA,,,,,,,,,
2,Manager-of-IT-Audit-and-Data-Analytics,Robert Half Technology,GA - Atlanta,$120k - $130k/year,00900-0011225244,"Ref ID: 00900-0011225244Classification: Sr. IT AuditorCompensation: $120000.00 to $130000.00 yearlyJOB FUNCTION: Job functions include but are not limited to the following.Assist IT management and company management by assessing IT processes and controls in order to maximize efficiencies and minimize risk.Continuously improve internal audit approaches, tools and methodologies.Set initiatives and provide guidance for data analytics projects.Develop and present data analytic engagement reports and findings to senior management.Provide direction to and support for the creation of ad-hoc/continuous monitoring reporting.Mentor and train staff on data analytic/fraud detection methodology and tools.Oversee the execution and completion of assurance-related engagements including evaluation of Service Organization Control (SOC) examinations (SSAE18, SOC Types 1, 2, 3 Reports), cyber security assessments, IT controls assessments and testing, fraud detection, internal control analysis, process documentation, development and implementation of accounting systems, selection and installation of accounting software.Identify and communicate IT audit findings to senior management and clients.Manage multiple audit projects and act as liaison between Internal Audit and IT management.Provide exceptional client service by planning, coordinating, and executing cross-functional internal audit and IT audit projects.Assist Internal Audit team with the performance of audits of financial statement elements and operations.Work with Internal Audit team members, external auditor, and IT management to develop a risk-based internal IT audit strategy that complies with professional standards, including the requirements of Sarbanes-Oxley Act section 404.Review testing of IT and operational controls to comply with internal audit and IT audit programs, including Sarbanes-Oxley.Manage audit and client expectations about deliverables, timing, and how the approach matches their needs.Benchmark Company IT processes to industry data.Participate in meetings with the IT management.Work closely with the Company's external auditor; provide appropriate support to the Company's external auditors in the performance of walkthroughs, as well as internal control/substantive testing.BACKGROUND / EXPERIENCE:8 years of relevant experience (IT, IT audit, Cyber Security, accounting, risk, regulatory, Sarbanes-Oxley, auditing, financial reporting, COSO, and/or compliance)No less than 4 years of external or internal audit experience3 or more years of data analysis experienceEDUCATION / KNOWLEDGE:Bachelors Degree (Management Information Systems, Computer Science, Accounting, Finance, Data Science etc.) requiredOne or more of the following preferred: CPA, CISA, CIA, CFE, CCEP, CISSPMBA plusBig 4 (Audit or Advisory Services), IT, Public Company Internal Audit, SOX, or Compliance experience a plusTechnology doesn't change the world. People do. As a technology staffing firm, we can't think of a more fitting mantra. We're extreme believers in technology and the incredible things it can do. But we know that behind every smart piece of software, every powerful processor, and every brilliant line of code is an even more brilliant person. Leader among IT staffing agencies The intersection of technology and people — it's where we live. Backed by more than 65 years of experience, Robert Half Technology is a leader among IT staffing agencies. Whether you're looking to hire experienced technology talent or find the best technology jobs, we are your IT expert to call. We understand not only the art of matching people, but also the science of technology. We use a proprietary matching tool that helps our staffing professionals connect just the right person to just the right job. And our network of industry connections and strategic partners remains unmatched. Apply for this job now or contact our branch office at 888-490-4429 to learn more about this position. All applicants applying for U.S. job openings must be authorized to work in the United States. All applicants applying for Canadian job openings must be authorized to work in Canada. © 2019 Robert Half Technology. An Equal Opportunity Employer M/F/Disability/Veterans. By clicking 'Apply Now' you are agreeing to Robert Half Terms of Use.Location US-GA-AtlantaEmployment Type Full-TimePay Type YearPay Rate $120,000.00 - $130,000.00 /YearStore Type Engineering,  Information Technology,  Design",Full-Time,Year,"$120,000.00 - $130,000.00 /Year","Engineering,  Information Technology,  Design",NA,,,,,,,,,
3,Senior-Data-Engineer,Robert Half Technology,TX - Austin,$115k - $130k/year,04160-0010956620,"Ref ID: 04160-0010956620Classification: Big Data EngineerCompensation: $115000.00 to $130000.00 yearlyYou will be responsible for building our data management strategy. You will work closely with software architects and data scientists, support data security efforts, push artificial intelligence models into production, and generate ETL pipelines. You will focus on building scalable and flexible infrastructure to support our evolving business requirements. You should be passionate about technology, collaborating with technical partners, and hyper-focused on delivering extraordinary results. If this sounds like you, we would love to meet you.Responsibilities•Building and maintaining critical ETL pipelines•Architecting and implementing secure data storage strategies for use by the Data Science and Software Engineering teams•Creating API endpoints for easy and secure data retrieval by relevant partners•Constructing infrastructure to incorporate third-party data sources into our machine learning models•Designing and executing strategies for real-time data analysis and decision-making•Conducting design reviews and code reviews•Collaborating with internal and external partners                  Requirements•BS or MS in Computer Science or other meaningful technical field•2+ years as a data engineer in production level systems•2+ years with object-oriented programming languages•Proficiency with Python and JavaScript•Familiarity with Linux and/or macOS•Proficiency with git, including branching, merging and rebasing•Experience with NoSQL databases (MongoDB preferred)•Deep understanding of data modeling and data partitioning•Ability to performance tune on scripts and networks•Experience with cloud computing (AWS or Google Cloud preferred)Preferred•Experience working with and designing micro-services architectures•High level understanding of DevOps technologies, specifically Docker•Experience working and building CI/CD production environmentsTechnology doesn't change the world. People do. As a technology staffing firm, we can't think of a more fitting mantra. We're extreme believers in technology and the incredible things it can do. But we know that behind every smart piece of software, every powerful processor, and every brilliant line of code is an even more brilliant person. Leader among IT staffing agencies The intersection of technology and people — it's where we live. Backed by more than 65 years of experience, Robert Half Technology is a leader among IT staffing agencies. Whether you're looking to hire experienced technology talent or find the best technology jobs, we are your IT expert to call. We understand not only the art of matching people, but also the science of technology. We use a proprietary matching tool that helps our staffing professionals connect just the right person to just the right job. And our network of industry connections and strategic partners remains unmatched. Apply for this job now or contact our branch office at 888-490-4429 to learn more about this position. All applicants applying for U.S. job openings must be authorized to work in the United States. All applicants applying for Canadian job openings must be authorized to work in Canada. © 2019 Robert Half Technology. An Equal Opportunity Employer M/F/Disability/Veterans. By clicking 'Apply Now' you are agreeing to Robert Half Terms of Use.Location US-TX-AustinEmployment Type Full-TimePay Type YearPay Rate $115,000.00 - $130,000.00 /YearStore Type Engineering,  Information Technology,  Design",Full-Time,Year,"$115,000.00 - $130,000.00 /Year","Engineering,  Information Technology,  Design",NA,,,,,,,,,
4,Data-Analytics-Manager,"TEKsystems, Inc",GA - Atlanta,N/A,NA," ***** CANDIDATES MUST BE ABLE TO WORK W2 *****Our client is seeking an experienced hands-on Manager to lead the data quality and business analyst functions of our Enterprise Data Lake and data analytics architecture team. This role will be a member of the Enterprise Data team that provides enablement for advanced analytics throughout the company by efficient ingest, storage and consumption of data both manufacturing and commercial as well enables data science model management, deployment and monitoring for various customer groups. The role is focused on developing Data Quality function of our enterprise data lake and the analytics areas. Another key area is at onset of the Analytics projects, develop the capability to gather and retain requirements and documentation for the data and automation needs for the models.  MUST HAVE SKILLS1. At least 5 years' experience testing, building or running enterprise-scale data analytics solutions.2. Experience in visualization tools for BI and front ends dashboards (Tableau, Qlik, PowerBI, SAS, R, SPSS)3. Experience building Data quality and QA procedures4. Experience creating business requirements and QA documentation.About TEKsystems:We're partners in transformation. We help clients activate ideas and solutions to take advantage of a new world of opportunity. We are a team of 80,000 strong, working with over 6,000 clients, including 80% of the Fortune 500, across North America, Europe and Asia. As an industry leader in Full-Stack Technology Services, Talent Services, and real-world application, we work with progressive leaders to drive change. That's the power of true partnership. TEKsystems is an Allegis Group company.The company is an equal opportunity employer and will consider all applications without regards to race, sex, age, color, religion, national origin, veteran status, disability, sexual orientation, gender identity, genetic information or any characteristic protected by law.If you would like to request a reasonable accommodation, such as the modification or adjustment of the job application process or interviewing process due to a disability, please call 888 472-3411 or email accommodation@teksystems .com for other accommodation options.                   Location US-GA-AtlantaEmployment Type Full-TimePay Type YearPay Rate N/AStore Type Information Technology",Full-Time,Year,N/A,Information Technology,NA,,,,,,,,,
5,Sr--Data-Engineer,"TEKsystems, Inc",CA - Irvine,N/A,NA,"Our data and analytics team is on a mission to re-architect and re-engineer the company's data platform by bringing the agility and scalability of the cloud. We are looking for an experienced Senior Data Engineer who is passionate about all things data and has prior hands on experience of loading large datasets utilizing the latest cloud technology to do so. The Senior Data Engineer will be intimately familiar with Amazon Web Services, Google Cloud Platform as well as other global cloud service providers. This candidate should have strong experience with large ETL projects, evidence of experience with cloud/modern ELT architecture, Data Lake and more. Job Expectations:Build robust, scalable real time and batch data pipelines using services like AWS Glue, Amazon EMR, SSIS, Python, PySpark, many others.Provide inputs in choosing and implementing cost effective, scalable and fault tolerant solutionsWell versed with modern data platforms and stay up to date with emerging trends in data engineering field.Work directly with business teams to extract, transform, and load data from a wide variety of data sources using SQL and other technologyFamiliar with Data Virtualization TechnologyKnowledge of Master Data Management specific to ETL processes.Improve ongoing reporting and analysis processes through automation, scale and best practiceImplement data structures using best practices in data modeling, ETL/ELT processes, and SQL, as well as other technologyPassion for data in all shapes and forms Knowledge, Skills and Abilities:Required: At least 7 years of experience with building data pipelines on cloud platforms like AWS and/or GCPHands on experience with Python, Spark and Kafka to build our next gen streaming data platform, ingesting TB of data monthly. Knowledge of Snowflake, Redshift, Athena, batch and Streaming data, Timeseries, KubernetesExperience building large data lakes in the cloud.Understanding of ETL and ELT, Informatica, AWS Glue, Google Cloud Dataprep, Amazon EMR and be able to choose the right tool for the job.Attending daily sprint meetings Working closely with PM and other upstream source system teams to address production issues.SQL server and SSISEquipment Knowledge: Understanding of eCommerce, global scale networks and cloud architecture, other big data technologiesExperience Requirements:7-10+ years of Data Platform expertiseSome form of formal education (boot camp) in Computer Science, Software Development, Database or related technologies  Education Requirements: Bachelor's Degree in Computer Science is highly preferred.About TEKsystems:We're partners in transformation. We help clients activate ideas and solutions to take advantage of a new world of opportunity. We are a team of 80,000 strong, working with over 6,000 clients, including 80% of the Fortune 500, across North America, Europe and Asia. As an industry leader in Full-Stack Technology Services, Talent Services, and real-world application, we work with progressive leaders to drive change. That's the power of true partnership. TEKsystems is an Allegis Group company.                   Location US-CA-IrvineEmployment Type Full-TimePay Type YearPay Rate N/AStore Type Information Technology",Full-Time,Year,N/A,Information Technology,NA,,,,,,,,,
