,Job_Title,Company_Name,Location,Compensation,Job_ID,Job_Description,Employment_Type,Pay_Type,Pay_Rate,Store_Type,Other_Compensation,Python,R ,Matlab,Excel,SAS,SQL,SPSS,Hadoop,Spark
25,Project-Manager,"TEKsystems, Inc",WA - Camas,N/A,NA,"The IT Project Manager (Infrastructure) independently manages a full range of projects, including the larger and more complex corporate or departmental projects and implementations. They organize, plan and execute projects, ensure adherence to deadlines, manage budgets, help define the project's objectives and oversee quality control. Responsibilities also include coordinating the efforts of team members and third-party contractors or consultants in order to deliver infrastructure projects according to plan.As a growing firm, we have several initiatives that will need an Infrastructure Project Manager's expertise on. Since the Infrastructure team is involved in anything from new platforms, technologies, upgrading data centers and new locations, a huge part of this role will require prioritization and communication around what's time sensitive, what can wait and what isn't a priority right now. At the same time, building relationships with stakeholders and colleagues will be imperative to your success.The Day-to-Day:Manages project outcomes against success benchmarks to ensure that results deliver on customer needs, requirements and their service expectations. Projects may be multi-year, multi-million dollar efforts involving the replacement of core business systems and involve process changes to multiple business unitsLeads and motivates teams and ensure projects are delivered with a high degree of qualityEffectively manages the project scope, budget, and timeline. Evaluates the impact to the project if changes are made to these constraintsIdentifies and manages potential risks or issues. Proactively develops contingency and mitigation plansInfluences decision-making, obtains buy-in, and negotiates resources, scope, and timelines with Project Sponsors, key stakeholders, and project team membersIdentifies the areas for improvements proactively and leads the project effort in standardizing the processes and procedures, streamlining, enhancing, and making processes superior and simpleManages the efficient day-to-day running of the IT project with best practice project methodology and collaboration capabilities to ensure success of the projectDelivers effective problem solving with an analytical mindset and taking end-to-end project ownership to prevent and solve problems, and to anticipate and avoid problems before they become project blockersTakes control of all assigned IT projects end-to-end to effectively challenge project members, ensure accountability, and inform stakeholders of project outcomesYour Qualifications: Bachelor's degree in MIS, computer science, math, or other science field, or equivalent combination of education and experienceDemonstrated experience managing medium to large infrastructure projects of various complexity4+ years of experience in IT Infrastructure & Operations Projects preferredWorking knowledge of MS Office, JIRA, MS Project, and/or Project Portfolio Management toolsExposure and familiarity with projects involving IT Infrastructure technologies such as network, telecom, systems engineering, data center, and storage in a Microsoft Windows environmentAbility to establish and maintain effective relationships with management , project team members, internal clients, and consultantsStrong ability to influence and persuade at all levels of the organizationKnowledge of waterfall and agile methodologies and experience managing projects in bothAbout TEKsystems:We're partners in transformation. We help clients activate ideas and solutions to take advantage of a new world of opportunity. We are a team of 80,000 strong, working with over 6,000 clients, including 80% of the Fortune 500, across North America, Europe and Asia. As an industry leader in Full-Stack Technology Services, Talent Services, and real-world application, we work with progressive leaders to drive change. That's the power of true partnership. TEKsystems is an Allegis Group company.The company is an equal opportunity employer and will consider all applications without regards to race, sex, age, color, religion, national origin, veteran status, disability, sexual orientation, gender identity, genetic information or any characteristic protected by law.If you would like to request a reasonable accommodation, such as the modification or adjustment of the job application process or interviewing process due to a disability, please call 888 472-3411 or email accommodation@teksystems .com for other accommodation options.                   Location US-WA-CamasEmployment Type Full-TimePay Type YearPay Rate N/AStore Type Information Technology",Full-Time,Year,N/A,Information Technology,NA,,,,,,,,,
26,Senior-UI-Developer,"TEKsystems, Inc",CA - Newport Beach,N/A,NA,"Project Description for Developers coming from financial background:'We're developing a centralized platform providing credit traders access to orders, analytics data, analysis tools, and liquidity with a completely customizable desktop experience and full interoperability across applications.We are seeking a Senior UI developer who will help in design, architecture and development of the engine behind our Trader Desktop Platform. The person in this role will build solutions in alignment with broader Technology platform guidelines and goals and which will be utilized for PIMCO's portfolio management and trading activities'Further details in development terms (for those not coming from financial background- open to both)* Lead the UI implementation of a highly interactive single page application (SPA) that allows users to slice and dice real-time streaming data flexibly and display results using different visualizations such as Grids and Charts/Graphs. * Must be able to propose user-friendly interface design based on UX best practices using wireframes, mockups and prototypes. * Job Description:We need talented UI developers to help create optimal user experiences within PIMCO trading applications.RESPONSIBILITIES:* UI development and support through analysis, design, coding, and testing* Continuously looking for opportunities for technical improvementsPOSITION REQUIREMENTS:* BS degree in Computer Science, Engineering or Math, or equivalent work experience* Strong knowledge of Angular/HTML (version 6+)* Strong knowledge of Typescript* Experience with NGRX/RxJS is recommended, but not required* Unit testing experience is strongly recommended (Karma or Jest)* 5+ years or experience and proficient understanding of web mark-up, including HTML5, CSS3 and Flex* Working knowledge of data structures, design patterns & algorithms.About TEKsystems:We're partners in transformation. We help clients activate ideas and solutions to take advantage of a new world of opportunity. We are a team of 80,000 strong, working with over 6,000 clients, including 80% of the Fortune 500, across North America, Europe and Asia. As an industry leader in Full-Stack Technology Services, Talent Services, and real-world application, we work with progressive leaders to drive change. That's the power of true partnership. TEKsystems is an Allegis Group company.                   Location US-CA-Newport BeachEmployment Type Full-TimePay Type YearPay Rate N/AStore Type Finance,  Information Technology",Full-Time,Year,N/A,"Finance,  Information Technology",NA,,,,,,,,,
27,Senior-Ios-Developer,"TEKsystems, Inc",TN - Knoxville,N/A,NA,"The iOS Developer will create software applications (apps) for mobile phones, tablets, set-top boxes, wearables, and other mobile devices. Primary development will be on Apple's iOS platform using iOS Xcode. Collaborates with UI/UX Designers, QA Analysts, Business Analysts, and Product Managers in support of the software development life cycle.* BS in Computer Science or equivalent training and experience* Ability to work independently in a fast-paced environment with frequent production releases* Understand the fundamentals of computers science, specifically algorithms and data structures* Strong communication skills* Strong problem solving and troubleshooting skills* Comprehensive software debugging skills* Can demonstrate the initiative and method for solving different problems, and propose effective solutions for those problems.* Can do regular reviews on code written by less experienced developers and offer feedback and suggestions for the code.* Can create unit tests* Extensive experience in solving problems of varying complexities.* Experience in improving the quality and structure of previously written code.* Understanding of common iOS design patterns, software engineering practices and principles.* Can communicate with stakeholders about the business processes of their projects and has the ability to transform business processes into programming code.* Can mentor the junior and mid-level developers of the team, and can designate tasks to team members in a balanced and effective manner.* Can comprehend the full scope of a project and recommend efficient methods to develop, test, implement, and maintain it.* Can create and write unit and integration tests.About TEKsystems:We're partners in transformation. We help clients activate ideas and solutions to take advantage of a new world of opportunity. We are a team of 80,000 strong, working with over 6,000 clients, including 80% of the Fortune 500, across North America, Europe and Asia. As an industry leader in Full-Stack Technology Services, Talent Services, and real-world application, we work with progressive leaders to drive change. That's the power of true partnership. TEKsystems is an Allegis Group company.The company is an equal opportunity employer and will consider all applications without regards to race, sex, age, color, religion, national origin, veteran status, disability, sexual orientation, gender identity, genetic information or any characteristic protected by law.If you would like to request a reasonable accommodation, such as the modification or adjustment of the job application process or interviewing process due to a disability, please call 888 472-3411 or email accommodation@teksystems .com for other accommodation options.                   Location US-TN-KnoxvilleEmployment Type Full-TimePay Type YearPay Rate N/AStore Type Information Technology",Full-Time,Year,N/A,Information Technology,NA,,,,,,,,,
28,Director-Of-Information-Technology,"TEKsystems, Inc",GA - Alpharetta,$150k - $170k/year,NA,"Our client is currently seeking a Director of Information TechnologyThe Director of Information Technology (IT) will oversee the IT team and own all infrastructure and applications within their ecosystem. The leader in this role is responsible for delivering innovative technology solutions for a data-driven organization that relies heavily on technology to drive results for its clients. The Director of IT will drive IT initiatives and create solutions that are repeatable, scalable and sustainable, ensuring they meet corporate Information Security and Data Privacy standards. The Director of Information Technology is responsible for reporting on the implementation projects and progress of technological plans to the company's leadershipSuccess in this role will require a combination of technology, analytics and operations experience, as well as the ability to manage large programs and teams. S/he will be the project champion for process improvements and technology changes, and will ensure the evolving needs of the company, its clients and programs are continually met. This person will also play a key strategic role in driving the highest possible levels of quality, efficiency and productivity across the entire organization.Essential Functions:* Lead and coach team of IT professionals, providing opportunities for personal and professional growth* Drives the planning, developing and implementing the IT budget and working with Procurement to obtain competitive pricing for new systems from suppliers to ensure cost effectiveness * Owns relationship with Corporate IS department building strong partnerships and fostering an Enterprise first mentality* Works closely with the company's Business Relationship Manager (BRM) to ensure their iniatives are conveyed and prioritized within AG IS' Enterprise Roadmaps* Works with corporate IS department to ensure upgrades, system patches and backups of hardware and software systems are maintained* Works with corporate IS department to ensure all Tier I infrastructure and applications are monitored and proper alerting occurs* Works closely with BISO and Information Security Office to ensure the company is following all corporate defined policies and initiatives* Ensures proper testing procedures are in place and followed to ensure a near-zero defect rate* Defines and owns technology governance process, ensuring environment remains secure and helps to reduce duplicative technology spend* Owns relationship with the company's technology vendors working with Corporate Procurement, understanding contractually what has been agreed to, and ensuring SLAs are in place, monitored and tracked* Ensure near 100% up-time for all company applications and infrastructure* Works closely with both and corporate Risk and Compliance groups to ensure Disaster Recovery and Business Continuity Plans are completed for all regions and testing is conducted on defined schedules* Responsible for RFI/RFP responses relating to infrastructure and applications and coordination with corporate IS to get related enterprise responses* Stay abreast of advances in technology* Evaluate the organization's technology use and needs and recommend improvements * Act as key company oversight for governance on all company platforms and for new technology requests * Continually measure platform performance against expected outcomes and leverage continuous improvement to enhance performance ensuring ROI for 's technology investments.Supervisory or Management Responsibility/Decision Making Level:This leadership position will manage a team playing a business-critical role at with key decision-making responsibility and critical delivery timelines. This person will need to lead their teams effectively, prioritize consistently, remain flexible and leverage strong relationships across all business functions to meet the needs of the business and its clients.Minimum Education and/or Experience:* Bachelor's degree in Computer Science, Business, Management Information Systems or related major or equivalent business experience. Master's degree preferred* 15+ years of experience in IS spanning multiple areas/disciplines* 10+ years of experience serving in a senior IS leadership and/or customer facing capacity providing technical thought leadership and influence to support business strategy * Extensive experience with executing strategic plans and technology roadmaps.* Proven leadership experience with implementing large-scale organizational change.Requisite Abilities and/or Skills:* Ability to direct multiple projects simultaneously* Must have the ability to proof read and edit content* Must be flexible and deadline driven* Team player able to work effectively at all levels of an organization with the ability to influence others to move toward consensus* Strong methodology for developing predictive models and supporting business campaigns based on analytical insights* Strong situational analysis and decision-making abilities* Must have good written, listening and verbal communication skills and be able to communicate with all levels of the organization* Highly motivated, collaborative, and innovative * Ability to operate successfully in cross-functional team* Written/Verbal Communication to SMEs and Stakeholders* A broad, enterprise-wide view of the business and varying degrees of appreciation for strategy, processes and capabilities, enabling technologies, and governance preferred* Additional job duties as assignedAbout TEKsystems:We're partners in transformation. We help clients activate ideas and solutions to take advantage of a new world of opportunity. We are a team of 80,000 strong, working with over 6,000 clients, including 80% of the Fortune 500, across North America, Europe and Asia. As an industry leader in Full-Stack Technology Services, Talent Services, and real-world application, we work with progressive leaders to drive change. That's the power of true partnership. TEKsystems is an Allegis Group company.The company is an equal opportunity employer and will consider all applications without regards to race, sex, age, color, religion, national origin, veteran status, disability, sexual orientation, gender identity, genetic information or any characteristic protected by law.If you would like to request a reasonable accommodation, such as the modification or adjustment of the job application process or interviewing process due to a disability, please call 888 472-3411 or email accommodation@teksystems .com for other accommodation options.                   Location US-GA-AlpharettaEmployment Type Full-TimePay Type YearPay Rate $150,000.00 - $170,000.00 /YearStore Type Information TechnologyOther Compensation: 30% bonus",Full-Time,Year,"$150,000.00 - $170,000.00 /Year",Information Technology,30% bonus,,,,,,,,,
29,Senior-Devops-Engineer,"TEKsystems, Inc",CA - Los Angeles,N/A,NA,"Sr. DevOps EngineerAs an industry leader with an unsurpassed service record, WASH provides outstanding laundry services to apartment properties, condominiums, military bases, and college and universities. With over 30 branch offices across the U.S. and Canada, WASH has over 70,000 locations with more than 5 million people using a WASH laundry room every week. Even with our solid reputation as an industry leader, our product isn't laundry equipment - it's customer service. WASH's mission is to provide best-in-class laundry room operations to our customers by delivering superior quality service. The driving force to our success continues to be our customer service. As we build upon our 70-year history, growth and innovation are at the forefront of our strategic goals. Over the past five years we've doubled in size, pioneered new advances in laundry room technology, and modernized our systems. In being a people-centered company, we provide professional development, promotional opportunities, and a learning environment to continue to innovate. If our spirit of innovation and customer-focused approach speaks to you, we'd like to meet you!Position Summary:The Sr. DevOps Engineer is responsible for developing the deployment framework for all of our applications and systems, managing the build and deployment pipelines and releasing successful code and applications to production that deliver business solutions to our internal teams, as well as external customers. This position has technical, process, and quality responsibility for all aspects of engineering: release management for application, API, and databases, Responsibilities:* Automate provisioning servers, environments (test & production), deployment of code, and perform configuration management* Manage source code repositories along with branching / merging strategy* Responsible for all aspects of release plan and production readiness checklist* Development of technical design documentation based on functional and stakeholders' requirements* Collaboration with project management team to ensure alignment and communication of project status or issues* Design, develop and deploy CI/CD and DevOps pipelines * Work as part of cross functional, passionate agile (SCRUM/Kanban) project teams ensuring high quality delivery is at the heart of the development process from requirements definition through to delivery * Ensure predictable delivery of quality releases * Research, recommend and implement tools as needed with the goal of continually increasing our development productivity* Proactively bringing issues and problems to the attention of the team; generating, proposing and implementing innovative solutions to solve them * Evangelize automation, Test Driven Development practices, Continuous Integration and Continuous Delivery mindset and use experiences to support the teams in these areas.* Maintain exceptionally high standards of design and code quality at all times, including but not limited to adherence to architectural, security and scalability standards and principles applied at WASH * Implement Code Quality and Security compliance tools for adherence with WASH standards. * Updates job knowledge by researching new internet/intranet technologies and software products; participating in educational opportunities; reading professional publications; maintaining personal networks; participating in professional organizations* Manage and maintain tools to automate engineering operations * Assess, analyze and strengthen the security of systems, data and access points * Assist in diagnosing and debugging issues within production systems* Integrate monitoring, logging and metrics frameworks Requirements:* BS / MS degree in Computer Science, Engineering or a related subject - or equivalent work experience 7+ years of recent experience of developing DevOps pipelines using container and other types of frameworks within an Agile environment * Working within UNIX/Linux, Windows, Docker, Virtualization and Node server environments.* Working knowledge of Continuous Integration and Continuous Delivery methods and toolsets * Expert experience with CI/CD tools such as Jenkins, Travis, Bamboo, TerraFarm, AWS CodePipeline / CodeDeploy or similar. * Expert experience with automation/configuration management - Chef, Puppet, Ansible, AWS CLI, PowerShell or similar* Strong Experience using library management tools like Maven, NuGet, JFrog, Nexus, SonaType, Artifactory or similar. * Strong experience with SQL and NoSQL databases such as MS SQL, MySQL, PostgreSQL, DB/2, MongoDB, DynamoDB. * Ability to work with Distributed Version Control Systems such as GIT (preferable) / Git Lab, Git Hub, or similar.* Solid scripting skills (e.g., shell scripts, Perl, Ruby, Python, Javascript).* Working knowledge AWS API Gateway, Lambda, Elastic Container Services, Elastic Bean Stalk, SNS, SQA, and server less computing.* Working knowledge of Cloud Databases such as AWS DynamoDB, AWS Aurora, AWS Redshift, Azure SQL, COSMOS is a plus* Willing to experiment with many ideas and showcase the output with peers and the wider teams Lifelong learner - thrives from developing and sharing knowledge * Excellent English communication skills (written & verbal) * Adapts communication style for junior engineers, senior engineers and senior management alike * Proactive 'self-starter' attitude * A creative, innovative and inquisitive character. * Uncomfortable with repetition seeking automation in preference* Ability to thrive in an environment of continuous change.* PLUS: Experience with SecOps * PLUS: AWS CertificationsAbout TEKsystems:We're partners in transformation. We help clients activate ideas and solutions to take advantage of a new world of opportunity. We are a team of 80,000 strong, working with over 6,000 clients, including 80% of the Fortune 500, across North America, Europe and Asia. As an industry leader in Full-Stack Technology Services, Talent Services, and real-world application, we work with progressive leaders to drive change. That's the power of true partnership. TEKsystems is an Allegis Group company.The company is an equal opportunity employer and will consider all applications without regards to race, sex, age, color, religion, national origin, veteran status, disability, sexual orientation, gender identity, genetic information or any characteristic protected by law. We will consider for employment all qualified applicants, including those with criminal histories, in a manner consistent with the requirements of applicable state and local laws, including the City of Los Angeles' Fair Chance Initiative for Hiring Ordinance.If you would like to request a reasonable accommodation, such as the modification or adjustment of the job application process or interviewing process due to a disability, please call 888 472-3411 or email accommodation@teksystems .com for other accommodation options.                   Location US-CA-Los AngelesEmployment Type Full-TimePay Type YearPay Rate N/AStore Type Information Technology",Full-Time,Year,N/A,Information Technology,NA,,,,,,,,,
