,Job_Title,Company_Name,Location,Compensation,Job_ID,Job_Description,Employment_Type,Pay_Type,Pay_Rate,Store_Type,Other_Compensation,Python,R ,Matlab,Excel,SAS,SQL,SPSS,Hadoop,Spark
39,Sr--Financial-Analyst-Great-Work-Life-Balance--Luv-,Robert Half Finance & Accounting U.S,GA - Atlanta,$70k - $80k/year,00900-0010911940,"Ref ID: 00900-0010911940Classification: Sr. Financial AnalystCompensation: $70000.00 to $80000.00 yearlyWe have been engaged by a industry leading company headquartered in Atlanta in its targeted search for an experienced Senior Financial Analyst. This role will be work with all facets of the business. Sr. Financial Analyst and reporting to the Finance ManagerResponsibilities will include: The Senior Analyst, Financial Planning, Analysis and Reporting will, develop and support complex financial and operational objectives (i.e. reporting, financial planning) and/or strategy. This role will also work collaboratively with other business units/departments to develop actions plans to support specific business objectives as well as develop financial forecasts to in support of overall company objectives. The Senior Analyst is responsible for critical and complex analysis, and reporting of financial and operational resultsPrepare monthly financial reporting package for the company, providing detailed business explanations behind variances against forecast, budget and prior year for Income Statement, Balance Sheet and Cash Flows. Gather data and perform analytical review of actual results versus budget, forecast, and prior year at varying levels of the organization and across different information systems for functions and business segments.Prepare, review and present financial projections and recast financial statements, provide variance analysis, research financial irregularities and use the analysis to develop meaningful financial reporting.Analyze financial performance, prepare monthly variance to forecasts and present recommendations to business unit management and operators. Develop, prepare and present specialized reports, forecasts, profitability analysis, pricing analysis, other ad-hoc projects and complex financial models.Track key performance indicators and provide analysis to support business decisions. Analyze and report on financial and/or operational results/analysis. Ensure historical information, current trends, regulatory environment and tax consequences are factored into analysis. Deliver ad hoc analytical projects to provide insights as required with focus on meeting deadlines and providing communication to management. Provides support to Senior Management including financial presentation and analysis. Assist in the coordination and analysis of recurring internal management reporting (Flash Financial Reporting, Operation Metric Reporting, etc.), the rolling forecast process, the Annual Operating Plan, and the Strategic Plan.Prepare presentations to highlight financial trends, summarize business plans, and communicate process changes across the enterprise.Identify and implement improvements across financial reporting processes.Analyze data and provide solutions/recommendations in response to anticipated and unanticipated fluctuations in the company’s business.Support the annual budget process including creation of financial models and budget presentation and explanation.Provide support for essential business improvement and corporate strategy projects.Enhance the content and create intuitive designs/layouts for company financial presentations.Only qualified candidates will be contacted and considered; please no phone callsIf you are interested in this opportunity with a growing organization please send resume to Luv Mirani at [Click Here to Email Your Resumé]Qualified Candidates will:Have a Bachelor of Science degree in Finance, Business, Accounting or EconomicsBachelor's degree (Finance or Accounting preferred) or equivalent experience. Have A minimum of 5 years of financial/analytical experience, along with experience at leading financial analysis projects preferred. Have Strong analytical skills and comfortable with large, complex data sets, legacy systems etc. Advanced Excel user including Pivot tables – Macros is a plusProficiency with PowerPoint to present financial models and forecastsExperience initiating and leading projects and ability to work with senior managers and key stakeholders in Corporate and Business Unit Departments. Must have a solid understanding of accounting knowledge/skills. Demonstrated leadership skills and experience in managing goals through collaboration and teamwork and leading financial reporting, financial variance analysis, product line analytics, and product development analyses, and close processHave good written and verbal communication skillsStrong interpersonal and oral/written/presentation communication skills required.Only qualified candidates will be considered and contacted. Please no phone callsClient is ready to hire asap!!!! For immediate and confidential consideration, please send resumes to Luv Mirani at [Click Here to Email Your Resumé]Robert Half Finance & Accounting, the world's leader in specialized financial staffing, provides exciting full-time opportunities in the areas of accounting, bookkeeping, finance, audit, taxation and more. We pioneered the professional staffing industry, and we've been successfully matching professionals with employers since 1948. Our proven proprietary processes, along with our relationships in 325 locations worldwide, allow us to provide you unparalleled access to exciting career opportunities. But don't take our word for it. Our company has appeared on Fortune® magazine’s list of “World's Most Admired Companies” since 1998, and 9 out of 10 of our customers would recommend our service to a colleague. Apply for this job now or contact our nearest office at 888.490.5461 for additional information. All applicants applying for U.S. job openings must be authorized to work in the United States. All applicants applying for Canadian job openings must be authorized to work in Canada.© 2019 Robert Half Finance & Accounting. An Equal Opportunity Employer M/F/Disability/Veterans.By clicking 'Apply Now' you are agreeing to Robert Half Terms of Use.Location US-GA-AtlantaEmployment Type Full-TimePay Type YearPay Rate $70,000.00 - $80,000.00 /YearStore Type Accounting,  Finance",Full-Time,Year,"$70,000.00 - $80,000.00 /Year","Accounting,  Finance",NA,,,,,,,,,
40,Manager-FP-A,Robert Half Finance & Accounting U.S,GA - Peachtree Corners,$95k - $100k/year,00900-0011198850,"Ref ID: 00900-0011198850Classification: Planning Analyst/Manager/DirectorCompensation: $95000.00 to $100000.00 yearlyWe have been engaged by an industry leading company with regional headquarters in Atlanta in its targeted search for an experienced Financial Planning & Analysis Manager. This role will be work with all facets of the business. Finance Manager and reporting to the Sr. Director of FinanceResponsibilities will include: The Manager, Financial Planning, Analysis and Reporting will, develop and support complex financial and operational objectives (i.e. reporting, financial planning) and/or strategy. This role will also work collaboratively with other business units/departments to develop actions plans to support specific business objectives as well as develop financial forecasts to in support of overall company objectives. The Finance Manager is responsible for critical and complex analysis, and reporting of financial and operational resultsPrepare monthly financial reporting package for the company, providing detailed business explanations behind variances against forecast, budget and prior year for Income Statement, Balance Sheet and Cash Flows. Gather data and perform analytical review of actual results versus budget, forecast, and prior year at varying levels of the organization and across different information systems for functions and business segments.Prepare, review and present financial projections and recast financial statements, provide variance analysis, research financial irregularities and use the analysis to develop meaningful financial reporting.Analyze financial performance, prepare monthly variance to forecasts and present recommendations to business unit management and operators. Develop, prepare and present specialized reports, forecasts, profitability analysis, pricing analysis, other ad-hoc projects and complex financial models.Track key performance indicators and provide analysis to support business decisions. Analyze and report on financial and/or operational results/analysis. Ensure historical information, current trends, regulatory environment and tax consequences are factored into analysis. Deliver ad hoc analytical projects to provide insights as required with focus on meeting deadlines and providing communication to management. Provides support to Senior Management including financial presentation and analysis. Assist in the coordination and analysis of recurring internal management reporting (Flash Financial Reporting, Operation Metric Reporting, etc.), the rolling forecast process, the Annual Operating Plan, and the Strategic Plan.Prepare presentations to highlight financial trends, summarize business plans, and communicate process changes across the enterprise.Support the annual budget process including creation of financial models and budget presentation and explanation.Provide support for essential business improvement and corporate strategy projects.Financial and operational planning, projections and budgeting process, including data management, analysis and reporting. Develops and coordinates financial forecasts and plans in support of the business unit's operational and strategic objectives. Enhance the content and create intuitive designs/layouts for company financial presentations.Only qualified candidates will be contacted and considered; please no phone callsIf you are interested in this opportunity with a growing organization please send resume to Sarah Rowland at [Click Here to Email Your Resumé]Qualified Candidates will:Have a Bachelor of Science degree in Finance, Business, Accounting or EconomicsBachelor's degree (Finance or Accounting preferred) or equivalent experience. Have A minimum of 5 years of financial and accounting experience. The ideal candidate will have an accounting background and transitioned to finance. Have Strong analytical skills and comfortable with large, complex data sets, legacy systems etc. Advanced Excel user including Pivot tables – Macros is a plusProficiency with PowerPoint to present financial models and forecastsExperience initiating and leading projects and ability to work with senior managers and key stakeholders in Corporate and Business Unit Departments. Must have a solid understanding of accounting knowledge/skills. Demonstrated leadership skills and experience in managing goals through collaboration and teamwork and leading financial reporting, financial variance analysis, product line analytics, and product development analyses, and close processHave good written and verbal communication skillsStrong interpersonal and oral/written/presentation communication skills required.Only qualified candidates will be considered and contacted. Please no phone callsClient is ready to hire asap!!!! For immediate and confidential consideration, please send resumes to Sarah Rowland at [Click Here to Email Your Resumé]Robert Half Finance & Accounting, the world's leader in specialized financial staffing, provides exciting full-time opportunities in the areas of accounting, bookkeeping, finance, audit, taxation and more. We pioneered the professional staffing industry, and we've been successfully matching professionals with employers since 1948. Our proven proprietary processes, along with our relationships in 325 locations worldwide, allow us to provide you unparalleled access to exciting career opportunities. But don't take our word for it. Our company has appeared on Fortune® magazine’s list of “World's Most Admired Companies” since 1998, and 9 out of 10 of our customers would recommend our service to a colleague. Apply for this job now or contact our nearest office at 888.490.5461 for additional information. All applicants applying for U.S. job openings must be authorized to work in the United States. All applicants applying for Canadian job openings must be authorized to work in Canada.© 2019 Robert Half Finance & Accounting. An Equal Opportunity Employer M/F/Disability/Veterans.By clicking 'Apply Now' you are agreeing to Robert Half Terms of Use.Location US-GA-Peachtree CornersEmployment Type Full-TimePay Type YearPay Rate $95,000.00 - $100,000.00 /YearStore Type Accounting,  Finance",Full-Time,Year,"$95,000.00 - $100,000.00 /Year","Accounting,  Finance",NA,,,,,,,,,
41,Senior-Indirect-Tax-Analyst--Luv-,Robert Half Finance & Accounting U.S,GA - Hapeville,$75k - $90k/year,00900-0010972796,"Ref ID: 00900-0010972796Classification: Tax Sr. - CorporateCompensation: $75000.00 to $90000.00 yearlyMy client located in Atlanta, GA is looking for a Senior Indirect Tax Analyst and reporting to the Tax ManagerManage monthly U.S. filing process from start to finish Reconcile and approve tax payment funding requests Manage internal control process for the sales tax bank account Oversee and reconcile all sales tax accounts monthly Prepare, review and file miscellaneous returns as needed Support internal controls for indirect tax processes Develop and execute internal audit of out sourced return processes, funding & filings The overall objective of this position is ensure compliance with all applicable state, local and foreign tax requirements and to satisfactorily resolve audits while minimizing the sales/use tax burden for the Company.Manage the sales/use tax compliance process and ensure timely and accurate reporting of such taxes in all appropriate jurisdictions. Responsible for efficient and effective compliance with sales and use tax, value-added taxOversee the management and integration of new legal entities, new operations, acquisitions and transactions into tax filings and processes on an ongoing basis. Ensure efficient and timely tax payment processes. Establish and monitor documentation requirementsManage sales and use tax audits (and similar transaction tax audits) initiated by taxing authorities and resolve such audits favorably at the lowest possible tax cost. Provide appropriate documentation and support for tax returns as filed on a timely basis to the auditor and provide other data as requestedResearch taxability issues and other issues in dispute and maintain appropriate documentation of research and proceedings on the audit process. Defend the Company’s tax position and negotiate toward effective resolution of the issues with the auditor. Manage risks associated with transaction tax audits. Maintain the audit log for tracking audits in progress and other relevant data on the audits. Keep senior management apprised of the status of audits, issues in dispute and potential exposure. Identify corrective action that is required to be taken to correct systemic issues or problems to prevent the recurrence of the audit liabilitiesMaintain state taxability matrices for products sold, fixed asset purchases and other expense itemsOnly qualified candidates will be contacted and considered; please no phone callsIf you are interested in this opportunity with a growing organization please send resumes to Luv Mirani at [Click Here to Email Your Resumé]Qualified Candidates will:Have a Bachelor of Science degree in Finance, Business, Accounting or EconomicsHave 3+ years of sales/use and state/local tax experience is requiredStrong technical knowledge of sales/use tax and transaction taxesEffective time management skills and resource management skillsHave good written and verbal communication skillsAbility to work in a team environment with collaborationStrong interpersonal and oral/written/presentation communication skills required.Only qualified candidates will be considered and contacted. Please no phone callsClient is ready to hire asap!!!! For immediate and confidential consideration, please send resumes to Luv Mirani at [Click Here to Email Your Resumé]Robert Half Finance & Accounting, the world's leader in specialized financial staffing, provides exciting full-time opportunities in the areas of accounting, bookkeeping, finance, audit, taxation and more. We pioneered the professional staffing industry, and we've been successfully matching professionals with employers since 1948. Our proven proprietary processes, along with our relationships in 325 locations worldwide, allow us to provide you unparalleled access to exciting career opportunities. But don't take our word for it. Our company has appeared on Fortune® magazine’s list of “World's Most Admired Companies” since 1998, and 9 out of 10 of our customers would recommend our service to a colleague. Apply for this job now or contact our nearest office at 888.490.5461 for additional information. All applicants applying for U.S. job openings must be authorized to work in the United States. All applicants applying for Canadian job openings must be authorized to work in Canada.© 2019 Robert Half Finance & Accounting. An Equal Opportunity Employer M/F/Disability/Veterans.By clicking 'Apply Now' you are agreeing to Robert Half Terms of Use.Location US-GA-HapevilleEmployment Type Full-TimePay Type YearPay Rate $75,000.00 - $90,000.00 /YearStore Type Accounting,  Finance",Full-Time,Year,"$75,000.00 - $90,000.00 /Year","Accounting,  Finance",NA,,,,,,,,,
42,Financial-Reporting-Manager-Opportunity---Due-to-Growth--Luv,Robert Half Finance & Accounting U.S,GA - Atlanta,$85k - $100k/year,00900-0010780592,"Ref ID: 00900-0010780592Classification: Director/Manager Financial ReportingCompensation: $85000.00 to $100000.00 yearlyMy client located in Atlanta, GA is looking for an Financial Reporting Manager and reporting to the ControllerDevelops, pro-actively, any reports needed to track the performance of the budgeted key drivers Develops and maintains executive financials & dashboards Analyzes financial information and extracts and defines relevant information ('what' factor) Interprets data in cooperation with SC Finance and the FPA department for the purpose of determining the root causes of past sales, financial, costing and operational performance ('why' factor) Develops and maintains reports for forecasting, trending and what-if analysis ('so-what' factor) Support period-end and year-end closing Assist in the coordination of the half year and year-end audit Maintains model for sales compensation Perform other related duties as assigned or requested. Responsible for performing and overseeing various tasks related to the month end close, including booking journal entries, preparing variance analysis and reconciling balance sheet accountsProfit/Loss Analysis, revenue analysis, ad-hoc reporting, cash flow analysisWork extensively with the Financial, Planning and Analysis group during month end close to explain forecast variances and unusual trendsProvide advice and guidance as necessary in preparing and analyzing timely and accurate financial reports and executing appropriate responsive actionsProvides advice and assistance to the Controller in analyzing and interpreting financial data and reportsOnly qualified candidates will be contacted and considered; please no phone callsIf you are interested in this opportunity with a growing organization please send resumes to Luv Mirani at [Click Here to Email Your Resumé]Qualified Candidates will:Have a Bachelor of Science degree in Finance, Business, Accounting or EconomicsHave 5+ years of Finance or related experience.Demonstrated leadership skills and experience in managing goals through collaboration and teamwork and leading financial reporting, financial variance analysis, product line analytics, and product development analyses, and close processHave good written and verbal communication skillsStrong interpersonal and oral/written/presentation communication skills required.Only qualified candidates will be considered and contacted. Please no phone callsClient is ready to hire asap!!!! For immediate and confidential consideration, please send resumes to Luv Mirani at [Click Here to Email Your Resumé]Robert Half Finance & Accounting, the world's leader in specialized financial staffing, provides exciting full-time opportunities in the areas of accounting, bookkeeping, finance, audit, taxation and more. We pioneered the professional staffing industry, and we've been successfully matching professionals with employers since 1948. Our proven proprietary processes, along with our relationships in 325 locations worldwide, allow us to provide you unparalleled access to exciting career opportunities. But don't take our word for it. Our company has appeared on Fortune® magazine’s list of “World's Most Admired Companies” since 1998, and 9 out of 10 of our customers would recommend our service to a colleague. Apply for this job now or contact our nearest office at 888.490.5461 for additional information. All applicants applying for U.S. job openings must be authorized to work in the United States. All applicants applying for Canadian job openings must be authorized to work in Canada.© 2019 Robert Half Finance & Accounting. An Equal Opportunity Employer M/F/Disability/Veterans.By clicking 'Apply Now' you are agreeing to Robert Half Terms of Use.Location US-GA-AtlantaEmployment Type Full-TimePay Type YearPay Rate $85,000.00 - $100,000.00 /YearStore Type Accounting,  Finance",Full-Time,Year,"$85,000.00 - $100,000.00 /Year","Accounting,  Finance",NA,,,,,,,,,
