,Job_Title,Company_Name,Location,Job_ID,Job_Description,Link,Compensation,Python,R ,Matlab,Excel,SAS,SQL,SPSS,Hadoop,Spark,Algebra,Statistic,Mathematics,Reinforcement_Learning,Deep_Learning,Machine_Learning,Data_Visualization,Keras,TensorFlow,Artificial_Intelligence,Communications,Team_Player,Empathy,Emotional_Intellect,Self_Improvement,Presentation,Critical_Thinking,Business_Understanding
0,Principal Data Scientist (Facilities Analytics),Northrop Grumman,"Redondo Beach, CA 90278",58367067-6657-41c9-abb6-46a6aefdf6eb,"
 At Northrop Grumman we develop cutting-edge technology that preserves freedom and advances human discovery. Our pioneering and inventive spirit has enabled us to be at the forefront of many technological advancements in our nation's history - from the first flight across the Atlantic Ocean, to stealth bombers, to landing on the moon. We continue to innovate with developments from launching the first commercial flight to space, to discovering the early beginnings of the universe. Our employees are not only part of history, they're making history. Northrop Grumman Aerospace Systems is seeking a Principal Data Scientist (Facilities Analytics) to join our facilities team of qualified, diverse individuals. This position will be located in Redondo Beach, CA. In this role, the selected candidate will:  Identify valuable data sources and automate collection processes as well as develop data mining and modeling plans. Describe, explore, and verify data quality.  Select, clean, construct, integrate, and format data.  Analyze large amounts of information to discover trends and patterns as well as to identify risks.  Select modeling techniques and develop visualizations of model results.  Collaborate with facilities engineering, projects, and maintenance teams to propose solutions and strategies to business challenges.  Performs data consolidation, cleansing and analysis, and presents data from one or more source systems.  Provide analysis and develops information papers, presentations, and other correspondence as required, including monthly presentations with internal and external stakeholders.  Apply operations research, statistical, mathematical, and analytical techniques related to Facilities Maintenance and Construction Projects.  Support the Facilities Reliability and Infrastructure Optimization department as required.Basic Qualifications:    Minimum of a bachelor's degree in Science, Technology, Engineering, or Math (STEM) field and five (5) years of data science / statistical analysis experience OR a master's degree in Science, Technology, Engineering, or Math (STEM) field and three (3) years of data science / statistical analysis experience.    Experience with mining, analyzing, and presenting data from a variety of sources.    Demonstrated experience using strong statistical and data visualization skills.    Proven ability to work under only general direction and independently determine and develop approaches to solutions. Work is reviewed upon completion for adequacy in meeting objectives.    Experience communicating requirements and working with internal and external customers to coordinate issues associated with specific projects/tasks.    Ability to obtain and maintain a security clearance (DoD TS/SCI with SSBI).    Demonstrated experience using business intelligence tools (example Tableau) and data frameworks.    Proficient in Microsoft Office.    Preferred Qualifications:    Current top secret clearance.     Aerospace industry experience.     Familiarity briefing senior level management and executive leadership.     Experience with modeling and simulations.     Ability to comprehend and analyze complex problems.    Northrop Grumman is committed to hiring and retaining a diverse workforce. We are proud to be an Equal Opportunity/Affirmative Action Employer, making decisions without regard to race, color, religion, creed, sex, sexual orientation, gender identity, marital status, national origin, age, veteran status, disability, or any other protected class. For our complete EEO/AA and Pay Transparency statement, please visit www.northropgrumman.com/EEO. U.S. Citizenship is required for most positions. ",https://job-openings.monster.com/principal-data-scientist-facilities-analytics-redondo-beach-ca-us-northrop-grumman/58367067-6657-41c9-abb6-46a6aefdf6eb,NA,0,1,0,0,0,0,0,0,0,0,1,1,0,0,0,1,0,0,0,0,0,0,0,0,1,0,0
1,Senior Data Scientist,CenturyLink,"BROOMFIELD, CO 80021",48489091-bfd0-4b0a-b07d-0e8b11d9f014,"
About CenturyLinkCenturyLink (NYSE: CTL) is the second largest U.S. communications provider to global enterprise customers. With customers in more than 60 countries and an intense focus on the customer experience, CenturyLink strives to be the world’s best networking company by solving customers’ increased demand for reliable and secure connections. The company also serves as its customers’ trusted partner, helping them manage increased network and IT complexity and providing managed network and cyber security solutions that help protect their business. Job Summary
The Data Scientist is a highly skilled individual contributor, under minimal supervision, who designs and develops programs, methods, processes, and systems to consolidate and analyze diverse, structured and unstructured “big data” sources to generate actionable insights and solutions using machine learning and advanced analytics.  Interprets and communicates insights and findings from analyses and experiments to other analysts, data scientists, and team members.Job Description
The Data Scientist proactively identifies meaningful insights by executing data discovery, exploratory data analysis, and iteratively developing predictive and prescriptive models to identify optimal solutions. This position will also assist with operationalizing the insights and solutions and changing business processes to maximize the value of those solutions.Analyze data and build predictive and prescriptive models in the areas of capacity planning, anomaly detection, predictive asset failure/maintenance, workload optimization, customer segmentation and business performance.Mine information for previously unknown patterns and insights hidden in these assets and leverage them for competitive advantage.The problems this position will solve will be at the cutting edge of technology and will lie at the intersection of science, engineering and business acumen.Qualifications
Specific Skills Required (Must have Skills):• Bachelor's Degree in Math, Computer Science, Data Mining, Machine Learning, Statistics or other quantitative discipline. Master's Degree preferred.• Experienced in writing formulas, expressions and algorithms as needed to support analytical work.• Understands data automation and how to best construct backend database environments and front end visualization for efficiency and recurring use.• Strong communication skills and relationship skills.• Ability to perform ad-hoc statistical analysis including correlation analysis, frequency distribution analysis, probabilistic modeling, sophisticated forecasting, and academic based predictive and prescriptive methods.• Capable of modeling the relationships between many sources of operational data, develop models that can serve to provide insight to support operational management, system optimization, dispatch system configurations and executive support for decision making.• Ability to write customized algorithms to drive predictive and prescriptive analysis in business management, creating actionable recommendations to improve Field Operations.• Ability to logically construct back end data base architecture that can support a growing system of analytical visualization in a Qliksense BI, and analytical decision-making engines.• Can be flexible to work on various types of projects, often balancing multiple deliverables with a wide range of complexity requirements.• Is comfortable working with teams, sharing code among peers, and presenting to leadership. • Has a genuine drive to succeed and self-motivated to “take care of business”, while positively representing the team.• Experience with SQL, database navigation in an Oracle data environment and Data Lake unstructured environments.• Python and/or R data script writing.• 3 + years' experience delivering Machine Learning and Advanced Analytics solutions.Alternate Location: US-Colorado-Broomfield; US-Colorado-LittletonRequisition #: 215691 This job may require successful completion of an online assessment. A brief description of the assessments can be viewed on our website at http://find.centurylink.jobs/testguides/ EEO StatementWe are committed to providing equal employment opportunities to all persons regardless of race, color, ancestry, citizenship, national origin, religion, veteran status, disability, genetic characteristic or information, age, gender, sexual orientation, gender identity, marital status, family status, pregnancy, or other legally protected status (collectively, “protected statuses”).  We do not tolerate unlawful discrimination in any employment decisions, including recruiting, hiring, compensation, promotion, benefits, discipline, termination, job assignments or training.DisclaimerThe above job definition information has been designed to indicate the general nature and level of work performed by employees within this classification. It is not designed to contain or be interpreted as a comprehensive inventory of all duties, responsibilities, and qualifications required of employees assigned to this job.  Job duties and responsibilities are subject to change based on changing business needs and conditions. ",https://job-openings.monster.com/senior-data-scientist-broomfield-co-us-centurylink/48489091-bfd0-4b0a-b07d-0e8b11d9f014,NA,1,1,0,0,0,1,0,0,0,0,1,1,0,0,1,1,0,0,0,1,1,0,0,0,0,0,0
2,Data Scientist,LRS,"Maryland Heights, MO",6c688631-a3d3-4044-a2a7-4ecfb69f4be6,"
Our client is in need of a Data Scientist. This is a 6 month right to hire opportunity in St. Louis, MO. If you’re that person, submit your resume now!LRS Consulting Services has been delivering the highest quality consultants to our clients since 1979. We've built a solid reputation for dealing with our clients and our consultants with honesty, integrity, and respect. We work hard every day to maintain that reputation, and we're very interested in candidates who can help us. If you're that candidate, this opportunity is made for you!Our client is seeking a Data Scientist who will be responsible for:Connecting data points and helping draw analytical insights from disparate data sources and on pieces of information that may or may not be connected today.  They should have a background in statistics, and/or visual data displays, and/or general data science.Qualifications:-5 years’ experience as a Data Analyst or Data Scientist-Experience with predictive analytics-Candidate must be able to effectively communicate in English (written & verbal) To apply go to jobs.lrs.com. LRS is an equal opportunity employer. Applicants for employment will receive consideration without unlawful discrimination based on race, color, religion, creed, national origin, sex, age, disability, marital status, gender identity, domestic partner status, sexual orientation, genetic information, citizenship status or protected veteran status.  Optional Skills:-Understanding of predictive analytics techniques leveraging machine learning algorithms-Past experience with Tableau, Spotfire, or similar preferred-Experience with Alteryx or similar a plus-Ability to explain insights uncovered from analyses-Background in statistics a plus-sql, r, matlab, etc a plus-experience with Hadoop Hive a plus ",https://job-openings.monster.com/data-scientist-maryland-heights-mo-us-lrs/6c688631-a3d3-4044-a2a7-4ecfb69f4be6,NA,0,0,1,0,0,1,0,1,0,0,1,0,0,0,1,0,0,0,0,0,0,0,0,0,0,0,0
3,Chief Data Scientist,Booz Allen Hamilton,"Alexandria, VA",11fb8116-487b-45d7-bb29-c5284a467934,"
Job Number: R0024324Chief Data ScientistKey Role:Serve as a senior technical leader of a data science and machine intelligence team, leveraging expertise with consulting to define business problems, work with and manipulate data, develop data science and machine learning algorithms and solutions, and develop machine learning models into production environments. Work across client sets to address business challenges, perform analysis, and explain the analysis to senior clients. Lead the identification of opportunities to apply knowledge and expertise of deep learning technologies to develop prototypes and analytic models to challenges with new and existing clients through the application of new, innovative capabilities. Lead and support engagements across government clients. Provide thought leadership, drive business growth within the market, and develop and maintain client relationships. Take an active role in the development, mentoring, and coaching of the team, work actively to enhance the diversity of the firm, and play a lead role in attracting, developing, and retaining talent.Basic Qualifications-10+ years of experience with designing, developing, and leading analytics or software development projects in Java, Scala, or other high-level languages-10 years of experience with program management in the IC-Experience with managing national intelligence programs-Experience in the application of data science and machine learning algorithms, including structured, unstructured, or relational and data mining and machine learning techniques-Experience with developing and mentoring staff at all levels and building an internal capacity to deliver high quality and highly innovative analytics services-Experience with developing and implementing successful market strategy and business development and leading proposal, project, and intellectual capital creation-Ability to manage programs with competing priorities-Active Top Secret clearance-BA or BS degree requiredAdditional Qualifications-Experience with developing analytics for geospatial and commercial imagery data-Experience with developing and driving cross-cutting capabilities or solutions-Experience with deep learning frameworks, including Theano, Torch, Caffe, or AWS Rekognition-Experience with Natural Language Processing toolkits, including Stanford NLP or OpenNLP-Experience with business development and leading proposal, project, and intellectual capital creation-Ability to be well-versed in modern software development techniques, methods, and technologies-MS degree in Computer Science, Mathematics, or Physics preferred; PhD degree in Computer Science, Mathematics, or Physics a plusClearanceApplicants selected will be subject to a security investigation and may need to meet eligibility requirements for access to classified information; Top Secret clearance is required.We're an EOE that empowers our people-no matter their race, color, religion, sex, gender identity, sexual orientation, national origin, disability, veteran status, or other protected characteristic-to fearlessly drive change.            ",https://job-openings.monster.com/chief-data-scientist-alexandria-va-us-booz-allen-hamilton/11fb8116-487b-45d7-bb29-c5284a467934,NA,0,0,0,0,0,0,0,0,0,0,0,1,0,1,1,0,0,0,0,0,0,0,0,0,0,0,0
4,Data Scientist,CBTS a Cincinnati Bell Company,"Cincinnati, OH 45202",206896014,"
CBTS is seeking a Senior Data Scientist to join our team. The initial focus of the role will be data classification (mining, analytics) for all of our internal business lines, eventually solving and transforming intensive man hour business problems into on-demand solutions through machine learning and analytics Candidates should have at minimum their Master’s degree but preferably their Doctorate as a Data Scientist.  Candidates should be thoroughly experienced in all areas of data analysis: advisory, strategy and implementation, including experience with business intelligence tools. To be clear, we are not looking for a Business Analyst, or someone that just knows how to utilize business intelligence tools, or just has experience with business intelligent reporting (although, those skill sets are required for this data analyst role). Nor are we seeking data analyst candidates from academia—candidates should come from a strong Data Analyst/Data Scientist background in IT.Of the required experience listed in the attached job description, the following are our top mandatory requirements: The candidate should have 6+ years of experience in data mining, data classification and data analytics including using BI tools and technologies (we won’t consider anyone with less than 6 years of experience (no exceptions)*—8 or more years is preferred.Experience with and knowledge of data warehouse and OLAP principlesQualitative & Quantitative Market Research, Analytical techniques, Statistical modeling, Analytical technology, Data interpretation / insight analysis, Data visualization, Insight storytelling, Desk research, Programming (Python, SQL, R or other), Quality assurance and testing.Proven working experience as a data scientist and business intelligence analystTechnical expertise regarding data models, database design development, data mining and segmentation techniquesThe person needs an ability to share and communicate ideas verbally, both orally and in writing, to executive staff, business sponsors, and technical resources in clear concise language that is the parlance of each group.This person will take the guesswork out of business decisions and help the entire organization thrive.The data analyst must be an effective bridge between different teams by analyzing new data, combining different reports, and translating the outcomes.The person will work in teams addressing statistical, machine learning and data understanding problems in multiple business environments.In this role, they will contribute to the development and deployment of modern machine learning, operational research, semantic analysis, and statistical methods for finding structure in large data sets.6-8 years of experience in data mining, data classification and data analytics including using BI tools and technologies (Microsoft Power BI, Tableau, IBM Cognos Analytics, SiSense, Qlik, Birst, Google Analytics, etc)Experience with and knowledge of Azure SQL Server and Traditional SQL Server data warehouse and OLAP principlesQualitative & Quantitative Market Research, Analytical techniques, Statistical modeling, Analytical technology, Data interpretation / insight analysis, Data visualization, Insight storytelling, Desk research, Programming (Python, SQL, R or other), Quality assurance and testing.Proven working experience as a data analyst and business intelligence analystTechnical expertise regarding data models, database design development, data mining and segmentation techniquesKnowledge of statistics and experience using statistical packages for analyzing data sets (Excel, SPSS, SAS etc.)Strong knowledge of and experience with reporting packages (Business Objects etc), databases (SQL etc), programming (XML, JavaScript, or ETL frameworks)Strong analytical skills with the ability to collect, organize, analyze, and disseminate significant amounts of information with attention to detail and accuracyAdept at queries, report writing and presenting findings Job DescriptionTechnical Skills: Use complex computer programs to mine data sources and look for trends.Analytical Skills: Determine what data trends mean. Being able to analyze the data is crucial.Using descriptive statistics to get a big-picture view of their data.Creating visualizations and dashboards to help the company interpret and make decisions with the data.Presenting the results of a technical analysis to business clients or internal teams.Evaluating statistical models to determine the validity of analyses.Using data science and machine learning to build better predictive algorithms.Using Artificial intelligence to interpret events, support and automate decisions, and to take actionsAbility to work in all levels and components of Azure SQL Server and traditional Data Warehouses consisting of ODS, Data Marts, Data Lakes and Data Warehouses.Testing and continuously improving the accuracy of machine learning models.Building data visualizations to summarize the conclusion of an advanced analysis.Integrating external or new data sets into existing data pipelines.Applying feature transformations for machine learning models on new data.Continuously monitoring and testing the system to ensure optimized performance. Preferred ExperienceDemonstrated awareness of feature extraction and real-time analytics methodsDemonstrated awareness of analytic prototyping, analytic scale-up, analytic scaling, and solutions integrationDemonstrated skill in the use of one or more analytic software tools or languages (e.g., SAS, SPSS, R, Python)Demonstrated skill in the use of one or more data mining tools/frameworks/languagesDemonstrated skill in the use of one or more data classification tools/frameworks/languagesDemonstrated skill at data cleansing, data quality assessment, and using analytics for data assessmentDemonstrated skill in the use of applied analytics, descriptive statistics, and predictive analytics on industrial data sets EDUCATION:Master’s Degree in a STEM major (Science, Technology, Engineering, Mathematics) but PhD is Preferred Cincinnati Bell Technology Solutions provides equal employment opportunities (EEO) to all employees and applicants for employment without regard to race, color, religion, gender, sexual orientation, gender identity or expression, national origin, age, disability, genetic information, marital status, amnesty, or status as a protected veteran in accordance with applicable federal, state and local laws  ",https://job-openings.monster.com/data-scientist-cincinnati-oh-us-cbts-a-cincinnati-bell-company/206896014,"$110,000.00 - $145,000.00  /yearBonuses and Full Benefits",1,1,0,1,1,1,1,0,0,0,1,1,0,0,1,1,0,0,1,0,0,0,0,0,0,0,0
5,Lead Data Scientist,Sezzle,"MINNEAPOLIS, MN 55401",213014027,"
TITLE: Lead Data ScientistDUTIES: Lead a team of data scientists and lead machine learning/data analysis projects. Partner cross-functionally with product and finance teams to drive strategy & optimize tactics related to risk and credit decisions. Use statistical and technology-based techniques to design a consumer debt and credit risk model to address business needs. Implement a model to recognize fraud case patterns & develop strategies to eliminate them. Identify process bottlenecks using data analysis skills and provide solutions. Use data visualization tools to facilitate performance assessment procedure and decision-making for firm employees who are not data specialists. Analyze and interpret impact of credit and risk strategies in line with broader corporate goals. Sales, net loss, revenue and growth projection through mathematical modeling and Monte Carlo simulation. Mentor and teach junior data scientists in deep learning methodologies based on project requirements.REQUIREMENTS: M.S. in Financial Mathematics or Statistics or foreign degree equivalent. Programming Languages: Python, C#, Golang, MATLAB; DB & Management Skills: MySQL, PostgreSQL, Prometheus SQL, Amazon Redshift, Object and Relational DB; Machine/Deep Learning Skills: Supervised & Unsupervised Learning, SVM, Pattern Recognition, Dimensionality Reduction, Reinforcement Learning, Convolutional Neural Networks, TensorFlow, Anomaly Detection, Optimization Algorithms, Monte Carlo Simulation; Business Intel Tools: Amazon Quicksight, Apache Superset, Grafana, Tableau. Demonstrate required skills through satisfactory completion of academic course work or project completion in graduate level program. Must complete “Data and Development” challenge during interview process to prove technical skills and abilities. The challenge should be completed within 2 hours using Python Jupyter notebook.SALARY: $95,000/yearHOURS: 40 hrs/week, M - F ",https://job-openings.monster.com/lead-data-scientist-minneapolis-mn-us-sezzle/213014027,"$95,000.00 - $95,000.00  /year",1,0,1,0,0,1,0,0,0,0,1,1,1,1,1,1,0,1,0,0,0,0,0,0,0,0,0
